ASN,Name
AS149664,PT NKNET Data Media
AS149665,PT Cybernet Data Multimedia
AS149667,PT Gading Bhakti Utama
AS149668,PT Komatsu Marketing And Support Indonesia
AS149669,Universitas Papua
AS149670,PT Siber Tech Indonesia
AS149671,PT Wonoarto Media Nusantara
AS149672,PT Aktech Digital Solutions
AS149673,PT Selaras Lintas Nusa
AS149674,PT Cloudwel Network Indonesia
AS149675,PT Garuda Lintas Cakrawala
AS149676,Dinas Komunikasi dan Informatika Kabupaten Lumajang
AS149677,CV Tepian Teknologi
AS149679,Pemerintah Provinsi Jawa Timur
AS149680,CV Restu Media
AS149681,PT Oreo Smart Access
AS149682,PT Aplikasi Platform Nomaden
AS149685,Universitas Wijaya Kusuma Surabaya
AS149687,PT Syawal Atlantik System
AS149688,PT Satelit Nusantara Tiga
AS149689,PT Akm Link Net
AS149690,CV Ali Media Network
AS149692,PT Barokah Nusantara Network
AS149693,PT Jaringan Datamedia Nusantara
AS149694,PT Oke Digital Media
AS149696,PT Network Center Nusantara
AS149697,PT Global Internet Solusindo
AS149698,PT Paramadaksa Teknologi Nusantara
AS149699,RSUD Dr Moewardi
AS149702,PT Gian Nugraha Teknologi Indonesia
AS149703,SMK Negeri 5 Malang
AS149704,PT Panglima Kamayo Media
AS149705,PT Wijaya Trimitra Indonesia
AS149707,PT Akses Data Internusa
AS149709,Universitas Amikom Purwokerto
AS149710,PT GEMILANG CATUR PERSADA
AS149712,KabelTelekom
AS149713,PT Lentera Digital Nusantara
AS149714,PT Lare Osing Ndo
AS149716,PT Mahakam Global Media
AS149717,PT Trans Koneksi Nusantara
AS149718,PT Satunol Digital Teknologi
AS149720,PT Adi Solusindo Teknologi
AS149721,PT Media Jaringan Telekomunikasi
AS149722,Dinas Komunikasi dan Informatika Kabupaten Kepulauan Metawai
AS149723,PT Afna Digital Indonesia
AS149725,PT Lintas Jaringan Nusantara
AS149728,PT Arsya Bintang Nusantara
AS149729,PT Rizki Tujuhbelas Kelola
AS149734,PEDEE
AS149735,PT. Teknologi Perdana Indonesia
AS149736,PT Satria Digital Media
AS149737,PT Data Lintas Media Indonesia
AS149740,PT Hebat Istimewa Geraknya
AS149741,Institut Agama Islam Negeri Lhokseumawe
AS149742,PT Urban Teknologi Nusantara
AS149744,PT Misqot Sejahtera Indonesia
AS149745,Politeknik Transportasi Darat Bali
AS149746,PT Blip Integrator Provider
AS149748,Dinas Komunikasi Dan Informatika Kab. Pamekasan
AS149749,Morizt ID
AS149752,PT. Nexa Media Pratama
AS149753,PT Global Sarana Mediakom
AS149754,PT Global Citra Teknologi
AS149758,PT Trimitra Cipta Bersama
AS149877,PT Integrasi Jaringan Ekosistem
AS149878,PT Callysta Total Solusindo
AS149880,PT Interkoneksi Data Nusantara
AS149881,PT. WIKAPLUS GLOBAL NUSANTARA
AS149882,PT Citra Agung Mestika
AS149883,PT Tekling Media Telematika
AS149885,PT Harmoni Networks Indonesia
AS149886,PPPK Petra
AS149888,PT Berkah Media Kusuma Vision
AS149889,Dinas Komunikasi dan Informatika Kab Soralangun
AS149890,CV Mentari Hakiki
AS149891,PT Maejin Karya Media
AS149893,PT Sima Bahtera Utama
AS149895,PT Angkasa Pura I
AS149896,PT Azkyal Network Madina
AS149897,PT Amanusa Telemedia Mahardika
AS149898,PT Retbizz Exabit Indonesia
AS149900,PT Kreasi Network Gorontalo
AS149901,PT Garuda Super Link
AS149902,PT Garuda Mitra Solusi
AS149903,PT Pandawa Lintas Media
AS149906,PT Wahana Data Solusindo
AS149907,PT Linkbit Inovasi Teknologi
AS149908,Pemerintah Kabupaten Asahan
AS149909,PT Panjalu Sarana Data Indonesia
AS149910,PT Ding Kloud Indokarya
AS149911,PT Blitar Sarana Data
AS149912,PT Graha Sumber Teknologi
AS149913,PT Sarana Kreasi Teknologi Indonusa
AS149915,PT Lintas Daya Nusantara
AS149917,PT. SILOKA INTEGRASI TEKNOLOGI
AS149920,PT Metro Ring Bersama
AS149921,PT Mandiri Global Data
AS149922,PT Asuransi Jasaraharja Putera
AS149923,PT Hadji Kalla
AS149924,PT Sugi Bintang Jaya
AS149925,PT Sakti Wijaya Network
AS149926,PT Ilham Wifi Solution
AS149927,Universitas Alma Ata Yogyakarta
AS149928,Dinas Komunikasi dan Informatika Kabupaten Dairi
AS149929,PT Aplikasi Platform Giga
AS149930,PT Replay Inti Media
AS149931,PT Salib Kasih Internet
AS149932,PT New Priok Container Terminal One
AS149933,PT Sahabat Manjur Grup
AS149934,PT Pangkalan Lintas Data
AS149935,PT Hanania Nusantara Abadi
AS149937,PT Profesional Telekomunikasi Indonesia
AS149938,PT Atha Internet Nusantara
AS149939,PT Danareksa (Persero)
AS149940,PT Mulia Batam Net
AS149942,PT Visioner Lima Solusindo
AS149943,PT Ayodya Data Internusa
AS149944,PT Dak Kite Kih Nabil
AS149945,PT Internet Corp Ltd
AS149946,PT Multinet Perkasa Indonesia
AS149947,PT Putra Perkasa Abadi
AS149948,PT Magna Network
AS149949,Universitas Mulawarman
AS149951,PT Dimensi Jaringan Bersinar
AS149961,PT Boma Eka Solusi Teknologi
AS149962,PT Antares Bintang Cemerlang
AS149963,PT Layanan Internet Sakti
AS149964,PT. MITRACOM SOLUSI TEKNOLOGI
AS149965,PT. TOBA JAYA NET
AS149966,Dinas Komunikasi & Informatika Kabupaten Nganjuk
AS149967,PT Indonesia China Mobile
AS149968,Diskominfo Kabupaten Humbang Hasundutan
AS149969,PT KB Valbury Sekuritas
AS149970,PT Bukit Asam Tbk
AS149971,PT Jujur Amanah Barokah
AS149972,PT Salingka Telekomunikasi Nusantara
AS149973,PT Goysen Solusi Teknologi
AS149974,Dinas Komunikasi dan Informatika Kabupaten Pemalang
AS149976,PT Adhelin Data Solution
AS150185,PT Prima Nala Mandiri
AS150186,PT Tristek Media Kreasindo
AS150187,PT Indo Teknologi Konstruksi
AS150188,Dinas Komunikasi dan Informatika Kabupaten Belitung
AS150191,PT Sarana Intimedia Telematika
AS150192,Politeknik Pelayaran Surabaya
AS150193,PT Olean Permata Telematika
AS150196,PT Arthaloka Reka Teknologi
AS150197,PT Curug Lintas Indonesia
AS150199,PT Jaringan Nusantara Samota
AS150200,PT Sarana Working Akses Indonesia
AS150202,PT Nanaka Network Communication
AS150203,PT. CHINA TELECOM INDONESIA
AS150204,PT Fastlink Koneksi Indonesia
AS150206,PT Rafa Teknologi Solusi
AS150207,PT Citra Cakrawala Pratama
AS150208,PT Internusa Duta Makmur
AS150210,PT Wadma Berkah Sedaya
AS150211,PT Jaringan VNTNET Indonesia
AS150213,PT Saka Media Komunika
AS150215,PT Era Bangun Indonesia
AS150216,PT Khazanah Net Indonesia
AS150218,PT Wijaya Mandiri Network
AS150219,PT Inertia Utama
AS150221,PT Smartlink Multimedia Network
AS150222,PT Paket Switch Bersama
AS150224,CV Trustnet Media
AS150226,PT Elite Teknologi Akademi
AS150228,PT Argiz Mitra Technology
AS150229,PT Wijaya Lintas Komindo
AS150230,PT. Jember Teknologi Solusi
AS150232,PT Disafa Cahaya Utama
AS150233,PT Maesa Nusantara Indonesia
AS150235,PT Insolikh Jaringan Multimedia
AS150237,PT Akses Digital Bersama
AS150240,PT Gusti Global Group
AS150241,PT Asianet Media Teknologi
AS150242,PT Kampung Dua Net
AS150243,CV. KHALISTA GROUP
AS150245,PT Sakti Media Telekomunikasi
AS150247,PT Pandawa Lima Java Network
AS150248,PT Global Jaringan Borneo
AS150249,PT Atharva Telematika Persada
AS150251,PT Akses Artha Media
AS150252,PT Kia Integrasi Akses
AS150253,PT. FINS MEDIATECHNO NUSANTARA
AS150254,PT Centrix Media Teknologi
AS150256,PT Interkoneksi Jaringan Data Nusantar
AS150257,PT Telindo Flash Mediatama
AS150259,PT Multi Guna Sinergi
AS150261,PT Cybermedia Network Nusantara
AS150262,PT Juli Digital Nusantara
AS150263,PT Alnet Telekomunikasi Indonesia
AS150265,PT Rajawali Bintang Cemerlang Telkomedia
AS150266,PT Inhqi Media Infotek
AS150267,Lembaga Administrasi Negara Republik Indonesia
AS150269,PT IX Telecom
AS150270,PT Mahkota Mas Insan Persada
AS150272,PT. GOLDEN NETWORK NUSANTARA
AS150273,PT Berkah Maju Interasional
AS150274,PT Gateway media Zafira
AS150275,PT Singoedan Media Network
AS150279,PT Lintas Network Solusi
AS150281,PT Bina Solusi Sejahtera
AS150283,"Dinas Komunikasi Informatika, Statistik dan Persandian Kabupaten Gowa"
AS150284,PT Pasti Mandiri Solusi
AS150460,PT Akses Sentral Teknologi
AS150461,PT Iftalink Media Karya
AS150462,PT Air Lintas Komunikasi
AS150464,PT Tanjung Pilar Teknologi
AS150466,PT Pesona Nusa Vision
AS150467,PT Handayani Fiber Media
AS150468,PT Bintang Teknologi Sejahtera
AS150469,PT Melesat Prima Nusantara
AS150470,PT Abadi Lentera Wahana Indonesia
AS150472,PT Umzah Sukses Jaringan Andalan
AS150474,PT Gunung Madu Plantations
AS150478,PT Solusi Teknologi Gemilang
AS150480,PT Swara Logika Laboratory
AS150482,PT Gapura Era Digital
AS150483,PT Kuantan Net Akses
AS150484,PT Jaringan Optic Nusantara
AS150487,NASATEL
AS150488,PT Teknologi Gema Informasi
AS150489,CV Gowtechno
AS150490,PT General Media Network
AS150492,Universitas Esa Unggul
AS150493,PT Gunung Sedayu Sentosa
AS150494,PT Aceh Digital Fenam
AS150495,PT. ANDAL SOFTWARE SEJAHTERA
AS150496,Dinas Komunikasi Dan Informatika Kabupaten Mimika
AS150498,PT Aidi Digital Global
AS150499,PT Desane Sinar Media
AS150501,PT Haci Telekomunikasi Indonesia
AS150503,PT Indo Tungkal Net
AS150504,PT CIGS Indonesia Digital
AS150505,PT Dunia Tak Terbatas
AS150506,PT Pusat Fiber Indonesia
AS150509,PT Twins Data Pratama
AS150510,PT Kawan Lama Sejahtera
AS150512,PT Maskom Indonesia Raya
AS150513,PT Brilliant Ecommerce Berjaya
AS150515,PT Agung Jaya Telekomunikasi Nusantara
AS150516,Badan Nasional Penanggulangan Terorisme
AS150517,PT Media Grasi Internet
AS150518,Kemenko PMK RI
AS150519,PT Harmonika Multimedia Sawangan
AS150521,Politeknik Pekerjaan Umum
AS150524,PT Lintas Data Banua
AS150526,PT Giandra Saka Media
AS150529,PT Sukha Karya Teknologi
AS150530,PT Mars Data Telekomunikasi
AS150532,Korpolairud Baharkam Polri
AS150533,Universitas Muhammadiyah Makassar
AS150534,PT Asuransi Etiqa Internasional Indonesia
AS150535,PT Jaringan Angkasa Intermedia
AS150536,PT Polarindo Media Nusantara
AS150539,PT Akses Utama Dinamika
AS150540,PT. Kalam Digital Signalindo
AS150541,PT Oren Abadi Sakti
AS150544,PT Global Visi Vindici
AS150546,Dinas Komunikasi dan Informatika Kabupaten Kediri
AS150549,PT JKB Telematika Indonesia
AS150550,PT Telekomunikasi Network Nusantara
AS150551,PT Triple Zhi Network
AS150552,PT Link Data Sumber Barokah
AS150553,PT Nusa Jaya Prasetyo
AS150554,PT Jaringan Tiang Indonesia Group
AS150555,PT Binerkahan Digital Telco
AS150556,CV KLIK FARM INDONESIA
AS150557,PT HASIBUAN TELEKOMUNIKASI INDONESIA
AS150558,PT Wayabung Global Network
AS150559,PT Genezis Mitra Technology
AS150690,PT Shankara Kalandra Jaya
AS150913,PT Alam Daur Nusantara
AS150914,PT Ned Link Telekomunikasi
AS150915,PT Borneo Global Persada
AS150917,PT Antar Data Informatika
AS150919,PT Trinity Media Indonesia
AS150920,PT Dua Empat Tujuh
AS150921,PT Satu Akses Indonesia
AS150923,PT Sistem Interkoneksi Data
AS150924,PT Hepra Teknologi Indonesia
AS150925,Pemerintah Daerah Kabupaten Sumenep Dinas Komunikasi dan Informatika
AS150926,PT Gerbang Sinergi Prima
AS150927,PT Lima Cahaya Kotim
AS150930,PT Kolaborasi Digital Bersama
AS150931,PT Denta Sejahtera Group
AS150932,PT Bayu Group Nusantara
AS150933,PT Cmdj Network Solution
AS150934,PT Hard Work Media Data Trans
AS150935,Dinas Komunikasi Informatika dan Statistik Kab. Ponorogo
AS150936,PT RECONET SEMESTA INDONESIA
AS150937,PT Neutron Mitra Nusantara
AS150938,PT Mitra Global Telemedia
AS150939,PT Indo Teknologi Logistic
AS150941,PT Duta Trans Nusantara Network
AS150942,LAMBDA
AS150943,"Dinas Komunikasi, Informatika, Statistik dan Persandian Kota Dumai"
AS150944,PT Mediatama Internusa Persada
AS150945,PT Harrisma Data Citta
AS150948,PT Existnet Mathesis Teknologi
AS150949,PT RumahNET Internusa
AS150951,PT Data Cyber Nusantara
AS150953,PT Satelit Nusantara Lima
AS150954,PT Jaringan Multimedia Cirebon
AS150955,PT Mitra Integra Telekom
AS150958,PT Fiber Data Nusantara
AS150959,PT SSR Digital Informatika
AS150960,PT. Maju Wijaya Network
AS150961,PT. Pandeglang Akses Semesta
AS150962,PT. Internet Rakyat Solusi Indonesia
AS150964,PT Level Indodata Teknologi
AS150965,PT BAS Network Indonesia
AS150966,PT Central Digital Network
AS150967,PT Buana Menara Indonesia
AS150968,PT Jaringanku Media Telekomunikasi
AS150969,Politeknik Negeri Madiun
AS150970,PT Kalimasada Inti Sarana
AS150971,PT Media Inovasi Data Indonesia
AS150973,PT Teknologi Madani Utama
AS150974,Dinas Komunikasi dan Informatika Kabupaten Tapin
AS150976,PT Mekarsari Digital Teknologi
AS150978,CV Bekantan Jantan
AS150979,CV Mitra Tower Utama
AS150980,PT Menara Digital Salama
AS150982,"Dinas Komunikasi, Informatika dan Persandian Kabupaten Kampar"
AS150984,PT Fitrah Marina Sukses
AS150985,PT Yadica Multimedia Nusantara
AS150986,PT Altafocus Media Center
AS150987,"Dinas Komunikasi, Informatika dan Statistik Kabupaten Bandung"
AS150988,PT Nusa Surya Ciptadana
AS150989,PT Media Akses Telematika
AS150990,PT Usyel Media Net
AS150991,PT Indowipi Global Network
AS150992,PT Purade Inas Sejahterah
AS150993,PT Angkasa Prima Teknologi
AS150994,PT Zuby Digital Network
AS150995,PT Bina Karsa Turaya
AS150997,PT Jakarta Infrastruktur Propertindo
AS150998,PT Atmega Telecomindo Nusantara
AS150999,PT Cipta Trimitra Perkasa
AS151000,PT Awan Data Indonesia
AS151001,PT Hantamo Web Cepat
AS151003,PT. Tri Akses Nusantara
AS151004,PT Jaringan Putra Nusantara
AS151005,PT Sarana Pactindo
AS151006,PT Nesta Indo Media
AS151009,PT Bittara Interkoneksi Nusantara
AS151011,"Dinas Komunikasi, Informatika, Statistik dan Persandian Kabupaten Kutai Timur"
AS151012,PT Bangun Nusa Network
AS151043,PT Lintas Data Internasional
AS151502,Dinas Komunikasi dan Informatika Kabupaten Kotawaringin Timur
AS151503,PT Uwais Borneo Group
AS151505,PT Iktiar Doa Tawakal
AS151506,PT Widjaja Piranti Teknologi
AS151507,PT Agung Barokah Network
AS151508,PT Terabyte Network Indonesia
AS151509,Pemerintah Kota Solok
AS151510,PT Pengkolan Akses Group
AS151511,PT Hulwa Tjaraka Teknologi
AS151512,PT Jenius Lintas Nusantara
AS151513,PT Infotech Tantami Nusantara
AS151514,PT Santoso Media Gemilang
AS151515,PT Surabaya Industrial Estate Rungkut
AS151516,PT Taffeta Fora Sistem
AS151517,PT Top Class Universal
AS151518,SMK Negeri 22 Jakarta
AS151519,PT Jaringan FIberku Indonesia
AS151520,PT Jaringan Internet Tayu
AS151521,PT. EXABIT GROUP NETWORK
AS151522,PT. LINTAS DATA TRANS
AS151526,PT One Network Eternity
AS151527,PT Jaringan Registri Indonesia
AS151528,PT Global Abadi Inti Nusantara
AS151529,PT Jaringan Fiberone Indonesia
AS151531,PT Data Telematika Indonesia
AS151532,Institut Agama Islam Negeri Bone
AS151536,PT Kahuripan Makmur Sentosa
AS151537,PT Salim Solusi Sejahtera
AS151538,PT Flashnet Inovasi Teknologi
AS151540,PT Digital Netcom Solution
AS151541,Universitas Muhammadiyah Jember
AS151542,PT Sahabat Fiber Indonesia
AS151543,Rumah Sakit Umum Daerah Tarakan Jakarta
AS151544,PDWNet
AS151545,PT Qiswah Mulia Alkhoir
AS151546,PT Asri Global Investama
AS151547,PT Mitra Bestari Prima Solusi
AS151548,PT Jaringan Komunikasi Anambas
AS151549,PT Sarana Kawan Setia
AS151552,PT Threego Technology Indonesia
AS151554,PT Pandawa Abadi Sentosa
AS151555,PT Jawara Lintas Data Nusantara
AS151556,PT Valbury Asia Futures
AS151559,PT Mitra Tera Sinergi
AS151560,PT Media Kerinci Network
AS151561,PT ASABRI
AS151564,PT Chuleyevo Telematika Timur Indonesia
AS151565,PT Noken Muliatama
AS151566,PT Risky Jaya Multimedia
AS151567,PT Tunas Media Data
AS151569,PT Telematika Media Solusi
AS151570,PT Meta Tekhnologi Nusantara
AS151571,PT Klikspot Telekomunikasi Indonesia
AS151572,PT Evolution Karya Lintas Data
AS151573,PT Kereta Cepat Indonesia China
AS151575,PT Jelajah Kreasi Informatika
AS151576,PT Mahawira Nusantara Grup
AS151577,PT Geka Solusi Utama
AS151578,Dinas Komunikasi Informatika Statistik dan Persandian Kabupaten Kepulauan Meranti
AS151579,PT Multimedia Data Sentra
AS151580,PT Bumi Multi Perkasa
AS151583,PT Satelit Global Media
AS151584,PT Indodata Solusi Persada
AS151585,PT Wifa Lintas Data
AS151586,PT Bintang Semesta Telematika
AS151587,PT Datu Digital Swatama
AS151588,PT Arjuna Lancar Teknologi
AS151589,PT Citra Prima Media
AS151590,PT Pandawa Global Telematika
AS151591,PT Cakra Techno Gemilang
AS151592,PT Awan Data Teknologi
AS151593,PT Jaringan Mitra Data
AS151594,Politeknik Penerbangan Surabaya
AS151595,PT Merdeka Media Teknologi
AS151596,PT Bank Nagari
AS151598,PT Meta Akses Indonesia
AS151599,PT Bintang Elektronik Netindo
AS151600,PT Inti Data Guna
AS151601,PT Borneo Inovasi Gemilang
AS151991,PT SWIN
AS151992,PT Jet Cyber Network Nusantara
AS151993,PT Wifian Global Nusantara
AS151994,PT Ranjaya Putra Teknik
AS151995,PT Wifipedia Sinergi Telematika
AS151996,PT Clara Network Engineer
AS151998,PT Halim Mitradana Internasional
AS151999,PT Aris Media Globalindo
AS152000,PT Jaringan Citra Mandiri
AS152001,PT Komunikasi Profesional Indonesia
AS152003,PT Citra Angkasa Lintas Media
AS152004,PT Tujuh Fondasi Teknologi
AS152005,PT Soultan Network Indonesia
AS152007,PT. Dunia Virtual Online
AS152008,PT Link Tujuh Seven
AS152009,PT Global Koneksi Investama
AS152010,PT Parimas Hicindo Sentosa
AS152011,PT Generasi Timor Nata Gayuh
AS152012,PT Nala Akses Nusantara
AS152013,PT Tiga Putra Zambiliz
AS152014,PT. Mitra Kita Brilian
AS152016,Sekolah Tinggi Ilmu Pelayaran Jakarta
AS152017,PT Digtel Tech Solutions
AS152018,PT Multimedia Trans Data
AS152019,PT Juragan Sembilan Sembilan Corp
AS152020,PT Kotanet Jaringan Telekomunikasi
AS152022,PT Netspeed Broadband Indonesia
AS152023,PT Gelam Net Solusi
AS152024,PT EDT Internet Solusi Indonesia
AS152025,PT Tungkal Lintas Bersama
AS152026,PT Anten Sarana Teknologi
AS152027,Bconn
AS152028,PT Ardei Gatra Mayantara
AS152029,PT Andromega Data Nusantara
AS152032,PT Putra Garsel Interkoneksi
AS152033,PT Mandari Teknologi Nusantara
AS152034,PT Lintas Jaringan Mandiri
AS152036,Politeknik Perkeretaapian Indonesia Madiun
AS152037,PT Datanet Solusi Makmur Berkah
AS152039,PT Batam Sinergi Net
AS152040,PT Barokah Abadi Sukses Teknologi
AS152041,PT. KARYA HASTA JAYA
AS152042,PT Equatra Indonesia
AS152044,Pemerintah Kota Banda Aceh
AS152045,PT Petabyte Network Indonesia
AS152048,PT Reueus Sumber Data
AS152049,PT Iconmedia Nusantara Abadi
AS152050,PT Era Zia Sakti
AS152052,PT Arsa Work Indonesia
AS152053,PT Bintang Tujuh Sinergi
AS152054,PT Mahato Lintas Buana
AS152055,PT Monsadata Nuansa Teknologi
AS152056,PT Sangkakala Gema Utama
AS152057,PT Dinoki Wayae Yoshe
AS152059,CV Brawijaya Giga Network
AS152060,PT Surya Bestari Lestari
AS152061,PT Merak Lintas Nusantara
AS152062,Universitas Peradaban
AS152066,PT Nawal Informasi Media
AS152067,PT Jaringan Teman Sejati
AS152068,Universitas Muhammadiyah A.R. Fachruddin
AS152069,PT Nusantara Star Connect
AS152070,PT Fasindo Multimedia
AS152071,PT Jalur Net Infotek
AS152072,Pemerintah Kabupaten Mamuju Tengah
AS152073,PT Media Balai Nusa
AS152074,Dinas Komunikasi Informatika Statistik dan Persandian Kabupaten Paser
AS152075,Universitas Singaperbangsa Karawang
AS152076,Badan Keamanan Laut RI
AS152078,PT Keluwih Medika Surabaya
AS152079,PT Meta Telekomunikasi Asia
AS152080,PT Fixy Sinergi Nusantara
AS152081,PT Zinet Media Nusantara
AS152082,PT Infonusa Teknologi Telekomunikasi Nusantara
AS152083,Dinas Komunikasi dan Informatika Kabupaten Ciamis
AS152084,PT Izzinet Metro Multimedia
AS152085,PT Global Network Tapanuli
AS152086,PT Ponorogo Wifi Nusantara
AS152087,PT Mega Cipta Netindo
AS152088,Universitas Islam Nahdlatul Ulama Jepara
AS152089,PT Singki Media Telekomunikasi
AS152344,PT Linea Global Teknologi
AS152345,PT Krui Internet Solution
AS152346,PT Persegi Nusa Media
AS152347,Politeknik Negeri Pontianak
AS152348,PT Internet Tjepat Indonesia
AS152349,PT Majapahit Network Indonesia
AS152350,Universitas Pertahanan Republik Indonesia
AS152351,PT. MITRA SINERGI JAYAABADI
AS152352,PT Dexano Ryu Fusena
AS152353,PT Hanan Media Solution
AS152354,PT Centra Mitra Telematika
AS152355,Dinas Komunikasi dan Informatika Kabupaten Malang
AS152356,PT Softnet Cyber Europe
AS152358,PT Gema Teknologi Cahaya Gemilang
AS152359,PT Rajawali Prisma Teknologi
AS152363,PT Delapan Broadband Intermedia
AS152364,Dinas Komunikasi dan Informatika Kabupaten Tebo
AS152365,Dinas Komunikasi Informatika Statistik dan Persandian Provinsi Papua Barat Daya
AS152366,PT Jaringanku Sarana Nusantara Pati
AS152367,PT Box Net Media
AS152368,PT Perwira Pedjoeang Nusantara
AS152369,PT. AKSES GENERASI CERDAS
AS152370,Balai Teknik Bendungan
AS152372,PT Trias Infra Sarana
AS152373,PT Anugerah Media Data Nusantara
AS152374,Perumda Tirtawening Kota Bandung
AS152375,PT Cynet Indonesia Networks
AS152376,PT. INDOTEK SOLUTION NETWORK
AS152377,PT Trimitra Aditama Koneksindo
AS152379,PT Fiberindo Telco Persada
AS152380,PT Jeff Network Nusantara
AS152382,PT Kartika Siger Network
AS152383,PT Mitra Telekomunikasi Nusantara
AS152384,PT Digitama Network Indonesia
AS152385,PT Bias Telemedia Sinergi
AS152386,PT Empat Data Link
AS152387,Rumah Sakit Panti Rapih
AS152388,PT Sinyal Khatulistiwa Network
AS152389,PT Kaf Tour Travel
AS152390,PT Intercloud Digital Inovasi
AS152391,PT Sheep Network Teknologi
AS152392,PT Bakung Jaya Network
AS152393,PT Gaisar Teknologi Bersama
AS152394,PT Arta Teletama Teknologi
AS152395,PT Giga Global Network
AS152396,PT Visioner Maju Bersama
AS152397,Nex+
AS152401,PT Airlink Media Data
AS152402,PT Media Link Corp
AS152406,PT Griya Akses Teknologi
AS152407,PT Netfinity Network Indonesia
AS152409,PT Smart Milenium Effisiensi
AS152410,PT Asterix Inovasi Teknologi
AS152411,PT Ismaya Djati Nuswantara
AS152412,PT Qelopak Teknologi Indonesia
AS152414,PT Pelita Akses Teknologi
AS152415,Universitas Bengkulu
AS152416,PT Barokah Sistem Telematika
AS152417,PT Arthaprima Mandiri Persada
AS152418,PT Lingga Telekomunikasi Nusantara
AS152419,PT Berbaur Network Connected
AS152421,PT Fiberlink Technology Indonesia
AS152422,Dinas Komunikasi dan Informatika Kabupaten Lamongan
AS152423,PT Sindoro Sumbing Network Solution
AS152424,PT Desible Eradata Komunikasi
AS152425,PT Muria Global Network
AS152426,PT Nawasena Andalan Indonesia
AS152427,Universitas PGRI Madiun
AS152428,PT Lintas Indotel Mandiri
AS152429,PT Era Network Indonesia
AS152430,PT Citra Meta Data
AS152431,PT Media Annur Nusantara
AS152432,PT Sinergi Innovate Pratama
AS152433,CV Klik Server Indonesia
AS152435,PT Konnek Jaya Bersama
AS152436,PT Erajaya Telco Indonesia
AS152437,PT Berlian Optical Solution
AS152438,PT BARAYA TELEKOMUNIKASI INDONESIA
AS152439,PT Applewifi Selalu Lancar
AS152440,PT Ashyla Karya Abadi
AS152441,PT Space Network Mediatama
AS152442,PT Erka Jaringan Utama
AS152744,PT Rapi Utama Indonesia
AS152745,CV Rakan Ponsel
AS152746,Universitas Aisyiyah Yogyakarta
AS152747,PT Nusantara Satulink Connected
AS152748,Universitas Metamedia
AS152749,PT Win Artha Mandiri
AS152753,PT Phainan Jaya Utama
AS152754,CV CRON INTERDATA NUSANTARA
AS152756,PT Jaringan Universal Online Solusindo
AS152757,PT DHAHA PRIMA NET
AS152758,PT AKSES DATA INDORAYA
AS152759,PT Viruzs Global Connection
AS152760,PT Bahar Mitra Net
AS152761,PT AJI RAFASYA ROSO ANTENG  BERKAH
AS152762,PT TELSAR JAYA NETWORK TEKNOLOGY
AS152763,PT MULTI KARUNIA ANUGERAH
AS152764,PT CEMERLANG INTERNET INDONESIA
AS152765,PT Haykal Solutions Technology
AS152766,PT Borneo Teknologi Edukasi
AS152767,PT SAMUDRA DIGITAL NETWORK
AS152768,PT Tiga Pilar Banua
AS152769,PT Gopal Network Solusindo
AS152770,PT Indotech Digitama Superlink
AS152771,PT Media Sembilan Sembilan Indonesia
AS152772,PT Prosperita Sistem Indonesia
AS152773,PT Chiabinet Jaringan Multimedia
AS152775,PT Taska Sarana Nusantara
AS152776,PT Distribusi Sukses Mandiri
AS152777,PT Runnet Media Utama
AS152779,PT Delta Solusi Internet
AS152780,PT SOLUSI ANDALAN KITA
AS152781,PT Buraq Telekomunikasi Indonesia
AS152782,PT ATLAS LINTAS INDONESIA
AS152783,PT ASTI DIGITAL INDONESIA
AS152785,PT Kreatif Data Prima Nusantara
AS152787,PT Jaringan Cyber Evo
AS152788,PT Altech Sistem Indonesia
AS152789,PT Galaxy Network Mediatama
AS152790,CV Arunika Investama
AS152791,PT Sinar Dharma Wijaya
AS152793,PT Fasnet Sky Fiber
AS152794,PT Net Patmedia Krama
AS152795,PT Jendela Transfer Dunia
AS152796,PT Satu Lima Indonesia
AS152797,PT Global Media Integra
AS152798,PT Aufa Berkah Media
AS152799,PT Warpik Solusi Internet
AS152800,PT Giga Media Internet
AS152801,PT Bintang Networks Solusindo
AS152802,PT Sarana Digital Network
AS152803,PT SSA Amanah Garahang
AS152804,PT Griya Telko Nusantara
AS152805,PT Sumber Kreasi Usaha
AS152806,PT Sinar Technology Jaya
AS152808,PT Jamkrida Jabar
AS152810,PT GALAXY SINERGI NETWORK
AS152811,PT SUMATERA TEKNOLOGI NETWORK
AS152815,PT Lintas Data Kita
AS152816,PT Takalink Access Indonesia
AS152817,PT Manunggal Sistem Sejahtera
AS152818,PT Marta Dwi Manunggal
AS152820,PT Kaltim Net Nusantara
AS152822,PT Bifimerah Network Solution
AS152823,PT Naura Network Nusantara
AS152824,PT Aldiyanur Mahakam Telemedia
AS152825,PT Teradata Bintang Selaras
AS152826,PT Aiira Media Solution
AS152827,PT Smartlink Teknologi Indonesia
AS152828,PT Global Akses Internusa
AS152829,PT Intercon Fiber Optic
AS152830,PT Elemen Jaringan Nusantara
AS152831,PT AURORA SENTRAL INFORMATIKA
AS152832,PT MAXLINK DATA PRIMA INDONESIA
AS152833,PT Tuxsindo Cyber Networks
AS152835,PT Tiga Media Solusi
AS152836,PT Ganesha Data Nusantara
AS152837,PT METTA UNIVERSAL NETWORK
AS152839,PT Seeplus Media Transformasi
AS152840,PT Bening Artha Lintas Data
AS152841,PT Lintas Media Solusindo
AS152842,PT Gesang Jaya Telekomunikasi
AS153059,PT Akses Datatrans Indonesia
AS153060,PT Nara Borneo Pratama
AS153061,PT Tekno Infrastruktur Sukses
AS153062,PT Sulbar Layanan Internet
AS153063,PT Juara Network Tegal
AS153064,PT Shs Solusindo Network
AS153065,PT Wiharya Reksa Karya
AS153068,Nusantara Global Exchange
AS153069,PT Akses Jaringan Indonesia
AS153070,PT Karangmukti Global Netmedia
AS153071,PT Cloudlink Ardtech Indonesia
AS153073,PT KANAL TELU MULTITEKNOLOGI
AS153074,PT JANUTELINDO SEJAHTERA NUSANTARA
AS153075,BPJS KESEHATAN
