ASN,Name
AS153076,PT SAVINDA ANTAR NUSANTARA
AS153077,PT Citra Akses Nusantara
AS153078,PT Global Menara Network
AS153079,PT Citra Jaya Adiwangsa
AS153081,PT Semua Apikasi Indonesia
AS153082,PT Terminal Kreasi Nusantara
AS153083,PT Awan Tiga Bintang
AS153084,PT Ghadhe Akses Mandiri
AS153085,PT Berkah Setia Digital
AS153086,PT Multi Media Sentral
AS153087,PT Telemedia Prima Nusantara
AS153088,PT Network Operation Solusindo
AS153091,PT Berkah Jaringan Nusantara
AS153092,PT Redi Revolusi Digital Solusi
AS153093,PT Surya Network Connection
AS153096,PT High Speed Connection Network
AS153098,PT Mms Digital Communication
AS153100,PT Jentre Media Nusa
AS153101,PT Kawan Teknologi Pratama
AS153102,PT Routelink Mediatech
AS153105,PT Nada Freedom Indonesia
AS153106,PT Nextmedia Teknologi Indonesia
AS153107,PT Rnet Mitra Sentosa
AS153108,PT Floria Ilham Barokah Group
AS153110,PT Tri Orion Prospekindo
AS153111,PT Jaringan Kita Bersama
AS153112,PT Luna Media Solusi
AS153114,PT Musik Internet Indonesia
AS153115,PT Nuansa Teknologi Informasi
AS153116,PT Mirzuno Solusi Komunikasi
AS153117,PT Globalindo Solusi Nusantara
AS153118,PT Cyberindo Telekomunikasi Borneo
AS153119,PT Intan Pariwara
AS153121,PT Pcr Solusi Teknologi
AS153122,PT Landak Annorty Net
AS153123,PT Fiberwave Siger Indonesia
AS153124,PT Cahaya Data Nusantara
AS153126,PT Tristan Utama Solutech
AS153127,PT Topsetting Sentra Akses
AS153128,PT Techchandra Solusi Telematika
AS153129,PT. Cashlez Worldwide Indonesia Tbk
AS153131,PT Maintek Juara Intisolusi
AS153132,PT Transformasi Informatika Teknologi
AS153134,PT Anugerah Creative Nusantara
AS153135,PT Netindo Persada Nusantara
AS153139,PT Digital Nusantara Sejati Group
AS153140,PT Karya Akbar Mandiri
AS153141,PT Jaringan Lintas Maritim
AS153143,PT Melodiva Music Gateway
AS153144,PT Bena Bentala Services
AS153145,PT Tomihonk Network Nusantara
AS153146,PT Gateway Network Services
AS153148,PT Bhatara Net
AS153149,PT Optical Light Nusantara
AS153150,PT Gerbang Nasional Akses Prima
AS153151,PT Diapa Angkasa Nusaintegra
AS153152,PT Sibay Global Network
AS153153,PT Data Multimedia Nusantara
AS153154,Universitas Katholik Soegijapranata
AS153155,PT Sigma Data Nusa
AS153156,PT Alsavanet Global Media
AS153157,PT Warisa Karya Teknologi
AS153158,PT Dukodu Digital Solution
AS153176,PT LAPAK REGISTAR MURAH
AS153327,PT. Adisesha Palladium Interchange
AS153382,Direktorat Layanan Aplikasi Informatika Pemerintahan
AS153479,PT Integra Putra Mandiri
AS153480,PT Andal Ciptamedia Sarana
AS153481,PT Ping Network Global
AS153485,PT. Mitra Technologi Informasi
AS153486,PT Aqrapana Daya Mandiri
AS153492,PT Integrasi Teknologi Informasi
AS153511,PT Kuning Media Nusantara
AS153514,PT Telekomunikasi Perdana Nusantara
AS153519,PT Shinta Buana Vision
AS153520,PT Galen Sakti Baroka
AS153538,PT MUNARA KIE RAHA
AS153546,PT INTIRAHA MEDIA AKSES
AS153554,PT Digital Bangun Mandiri
AS153555,PT STAR HOME INDONESIA
AS153559,PT MAULANA JAYA MEDIA
AS153565,PT Intan Digital Internet
AS153570,PT JARINGAN LINTAS KAWANESIA
AS153573,PT BAYU MULTIMEDIA TELEKOMUNIKASI
AS153575,PT PALLAKA ELEKTRO TELEKOMUNIKASI
AS153576,PT JARINGAN LINTAS SELATAN SOLUSINDO
AS153577,PT NETWORK SOLUTION PERSADA
AS153578,PT Koneksi Indonesia Lintas Arta
AS153579,PT Wirelessindo Solusi Teknologi
AS153580,PT AZKA INDO NETWORK
AS153582,PT INFINITY GLOBAL DATA NUSANTARA
AS153583,PT POLARIS LINTAS NUSANTARA
AS153584,PT Quel Teknologi Indonesia
AS153600,PT VESAKHA SECEPAT KILAT
AS153601,PT Bank Oke Indonesia Tbk
AS153609,"Dinas Komunikasi, Informatika Dan Statistik Kabupaten Kepulauan Anambas"
AS153615,PT Lentera Abadi Solusinet
AS153618,PT OVALL SOLUSINDO MANDIRI
AS153636,PT Erzar Inti Solusi
AS153646,PT Digikarsa Nusantara Internasional
AS153658,PT HEXA TELEMATIKA INDONESIA
AS153664,PT NAOMI AURORA TEKNOLOGI
AS153666,PT JARINGAN INTERNET TERPADU
AS153670,PT NAFIS GLOBAL VISI
AS153673,PT Pioneer Nusatama Technology
AS153682,PT Kemenangan Bersama Nusantara
AS153690,PT Menara Langit Nusantara
AS153693,Kepolisian Daerah Jawa Tengah
AS153697,PT Big Network Indonesia
AS153699,PT Sukanda Djaya
AS153707,PT Multisemesta Data Nusantara
AS153716,PT AtoZ Teknik Sejahtera
AS153717,PT Diaza Lintas Data
AS153718,PT Jelajah Media Komunikasi
AS153727,PT QUEENQINAN DATAMEDIA MANDIRI
AS153728,PT FAFI UIFI NETWORK
AS153729,PT Tekno Indo Jaya
AS153745,Sayagi
AS153753,PT METROMATIKA TEKNOLOGI REKAYASA
AS153768,PT Signall Network Nusantara
AS153769,RSUD Pandan Arang Boyolali
AS153774,PT Microcyber Data Indonesia
AS153796,PT Darussalam Media Group
AS153797,PT DCCONNECT AUTOMATION TECHNOLOGY
AS153801,PT Bella Intan Media
AS153803,PT Trans Link Internasional
AS153804,PT Jagoan Data Nusantara
AS153805,PT Indonesia Dial Network
AS153806,PT Dra Net Solution
AS153807,"Dinas Komunikasi, Informatika, Statistik Dan Persandian Kabupaten Balangan"
AS153816,PT Asiana Mika Indonesia
AS153818,PT MARAJA DIGITAL NUSANTARA
AS153820,PT EXA TELEKOMUNIKASI NUSANTARA
AS153822,PT EMLIMA KONEKSI NUSANTARA
AS153823,PT JARINGAN TEKNOLOGI SEJAHTERA
AS153824,PT Aksara Sarana Telematika
AS153825,Institut Teknologi Padang
AS153835,PT Fibersa Indotama Network
AS153839,PT Tenjo Nurcahaya Jayabhatara
AS153840,PT Andalas Solusi Network
AS153843,Lembaga Ketahanan Nasional
AS153848,PT Jaya Cipta Digital
AS153849,PT HAQINET MEDIA COM
AS153858,PT SOKKA TAMA FIBER
AS153863,PT BAHAGIA WYN BERSAMA
AS153871,PT SOLUSI INOVASI BISNIS
AS153876,PT Oofydi Media Group
AS153877,PT GORO DIGITAL NUSANTARA
AS153880,PT Hyundai Capital Finance Indonesia
AS153882,PT JARINGAN INFRA ANDALAN
AS153887,PT DASA INFRA INDONESIA
AS153888,PT Fiber Bahana Tatamitra Solusi
AS153889,PT Media Central Access
AS153893,PT TENGGARA MULTIMEDIA GEMILANG
AS153895,PT Rajasa Sinergi Komunikasi
AS153896,PT Shofanet Media Telekomunikasi
AS153903,Yayasan Atma Jaya
AS153904,PT Equator Telecom Indonesia
AS153910,PT Ryza Data Nusantara
AS153917,PT Star Nusantara Network
AS153918,PT SALSA MEDIA DATA SOLUSINDO
AS153921,PT Citra Data Telematika
AS153922,PT Tridata Teknologi Indonesia
AS153923,CV Cyber Earth Multicorp
AS153924,PT Labima Global Solusindo
AS153925,PT Timeless Network Group
AS153936,PT DINAMIKA TEKNOLOGI NUSA
AS153937,PT Ring Data Prima
AS153938,PT Digital Omni Telekomunikasi
AS153939,PT Sandeq Media Teknologi
AS153940,PT Win Akselerasi Net Indonesia
AS153943,PT Media Infrastruktur Teknik
AS153945,PT THC DIGITAL SOLUTION
AS153946,PT KREASI INDOKARYA NETWORK
AS153961,PT Connexa Digital Network
AS153962,PT Wismilak Inti Makmur TBK
AS153963,PT Lengkong Network Indonesia
AS153965,PT Starlink Network Digital
AS153968,PT MERDEKA TELEKOMUNIKASI CENTER
AS153978,PT Sarana Komunikasi Semesta
AS153985,PT LAYANAN SERVER INDONESIA
AS153986,PT Network Bumi Saridin
AS153987,PT Dua Data Komunika
AS153992,PT Kirana Karina Network
AS154007,Institut Agama Islam Negeri Syaikh Abdurrahman Siddik Bangka Belitung
AS154008,PT SAKRAL INTERMEDIA GLOBAL NETWORK PERSADA
AS154023,PT Global Usaha Teknologi
AS154039,PT Awan Media Digital
AS154056,PT Metadata Teknovasi Nusantara
AS154067,PT Inti Siber Net
AS154074,PT Alfaqih Azzam Network
AS154075,PT Mitra Keutamaan Abadi
AS154078,PT JENDRAL INOMASA NETWORK
AS154093,PT Sentral Link Solutions
AS154097,PT INTERNET BERKAH SULAWESI
AS154101,PT OMNIA TEKNOLOGI INDONESIA
AS154122,PT Penjaminan Kredit Daerah Provinsi Jawa Tengah
AS154123,PT Rayunet Broadcast Solution
AS154124,PT Global Media Jaringan Nasional
AS154128,PT Elviana Jaringan Nusantara
AS154141,PT Satu Jaringan Nasional
AS154143,PT AZWAR DIGITAL NETWORKS
AS154145,PT Andika Media Data
AS154146,PT Global Asta Systelematika
AS154153,PT Bimanet Media Nusantara
AS154154,PT BORNEO FIBER TEKNOLOGI
AS154159,PT Global Nusa Telekomunikasi
AS154164,PT Idx Solusi Teknologi Informasi
AS154178,Rumah Sakit Umum Pusat Dr. Soeradji Tritonegoro Klaten
AS154191,PT WIFIKCB LINTAS DATA
AS154195,Kementerian Pemberdayaan Perempuan Dan Perlindungan Anak
AS154196,PT Terra Net Indonesia
AS154197,PT Reload Media Telematika
AS154201,PT GIGA NETWORK INDONESIA
AS154202,PT VIALINK TEKNOLOGI DIGITAL
AS154203,PT DELTA SKY TECH
AS154205,PT Susu Teknologi Indonesia
AS154208,PT GIRI DATA SOLUSINDO
AS154210,PT Pituama Unggulan Teknologi
AS154217,PT Fiber Akses Nusantara
AS154218,PT LINTAS JARINGAN TUNGKAL
AS154226,PT GLOBAL ACCESS SMART SOLUTIONS
AS154233,PT Cyber Satria Indonesia
AS154244,PT EMPAT SAUDARA MULIA
AS154248,PT Telemedia Cakra Nusantara
AS154252,PT Superlink Supratama Lintasnusa
AS154265,PT Andalan Media Raya
AS154266,PT TELEKOMUNIKASI INDO PRIMA
AS154281,PT GLOBAL DIGITAL CORE
AS154291,PT NEXORA DATA OPTIMA
AS154292,Politeknik Kesehatan Palembang
AS154303,PT Danamas Insan Kreasi Andalan
AS154312,PT Sarana Mandiri Teknologi Grup
AS154314,PT Eno Cyber Sentinel
AS154318,PT Rako Media Network
AS154330,PT Elevenia Digital Teknologi Sukses
AS154331,PT CITRA BINTANG NET
AS154336,PT PEGADAIAN
AS154337,PT Kledo Berhati Nyaman
AS154344,PT Java Internet Solution
AS154345,PT Dlimo Network Nusantara
AS154347,PT Anagata Akusara Semesta
AS154349,PT Asa Kreasi Interasia
AS154353,PT Indo Cahaya Network
AS154354,Politeknik Negeri Lhokseumawe
AS154365,PT Bagian Teknologi Nusantara
AS154367,"Dinas Komunikasi dan Informatika, Statistik Dan Persandian Kabupaten Tuban"
AS154369,PT PASIFIK CIPTA NUSANTARA
AS154372,PT Server Nusantara Sejahtera
AS154385,PT PRIMA INDO SENTOSA
AS154387,PT Lintas Trans Khatulistiwa
AS154393,PT Flok Global Utama
AS154397,PT Bintang Emas Nusantara Tujuh Tujuh
AS154400,PT Jaringan Merah Putih
AS154401,PT Sahabat Internet Nusantara
AS154413,PT Busano Internet Kita
AS154414,PT Citratama Lintas Buana
AS154415,PT Bajastu Teknologi Waringin
AS154423,PT Java Selebes Network
AS154427,PT Digital Unique Indonesia
AS154430,PT Abel Multi Network
AS154440,Dinas Komunikasi & Informatika Kota Cimahi
AS154442,PT Asa Trio Network
AS154444,PT Nusa Data Koneksi
AS154452,PT Berkah Solution Tatawafaqu
AS154454,PT Dikta Teknologi
AS154458,PT Satya Yudhistira Ranajaya
AS154459,PT CAKRA BUANA TEKNOLOGI
AS154475,PT Permata Data Nusantara
AS154479,PT Panca Cita Synetrix
AS154480,PT Gerbang Nusantara Sakti
AS154483,PT Galaktik Optika Omni Data
AS154492,PROTERGO
AS154494,PT Selaras Teknologi Utama
AS154495,PT Sterlink Permata Indonesia
AS154503,PT Trimafa Computindo Networking
AS154509,PT LANGIT BORNEO NETWORK
AS154520,PT NEUCENTRA JARINGAN INDONESIA
AS154521,PT Digital Prima Solution
AS154522,PT Quicknet Nusantara Teknologi
AS154523,PT Ali Telematika Nusantara
AS154527,PT Mikrolink Elektra Data
AS154528,Dinas Komunikasi Informatika Statistik Dan Persandian Kota Pekanbaru
AS154533,PT VALIDASI RUANG TEKNOLOGI
AS154536,PT Zaiad Network Nusantara
AS154538,PT Pringsewu Digital Nusantara
AS154547,PT MASHANZ SUMBER TERBUKA
AS154548,PT DYANDRA BORNEO NETWORK
AS154555,PT Indonesia Global Networks
AS154556,PT Tori Network Teknologi
AS154574,PT Rokan Network Solution
AS154582,PT Telekomunikasi Jaringan Dinamis
AS154583,PT DIGITAL MYFREND SOLUSINDO
AS154586,PT Roba Digital Akses
AS154590,PT Sera Koneksi Nusantara
AS154607,PT EXTREME AKSES TELEKOMUNIKASI
AS154616,PT INFOMATICS OASE
AS154628,PT Sinergi Multidata Utama
AS154629,PT Garuda Network Nusantara Sinergi
AS154630,PT Teknologi Media Cepat
AS154637,PT Kuantum Bhinneka Wishaka
AS154651,PT Sarang Datas Nusantara
AS154657,PT PANHA NETWORK SOLUTION
AS154663,PT SIGNAL PRIMA SOLUSI
AS154669,PT Azvi Multi Teknologi
AS154684,PT Senyum Diskon Indonesia
AS17440,PT Sinar Alam Abadi
AS17450,"PT Bank Central Asia, Tbk"
AS17451,BIZNET NETWORKS
AS17538,PT. Circlecom Nusantara Indonesia
AS17553,Bogor Agricultural University
AS17658,PrimaNet - PT. Khasanah Timur Indonesia
AS17670,PT. MNC Kabel Mediacom
AS17671,JETCOMS-ID
AS17725,Pertamina Hulu Energi ONWJ
AS17727,PT. NAP Info Lintas Nusa
AS17769,PT Indopratama Teleglobal (ISP)Wisma BSG Floor 6
AS17817,Concentrix Daksh Services India Private Limited
AS17826,PT Satata Neka Tama
AS17884,PT. Uninet Media Sakti (ISP)
AS17885,PT XL Axiata Tbk
AS17910,PT. Tigatra Infokom
AS17922,INDOSAT Internet Network Provider
AS17995,PT iForte Global Internet
AS17996,PT Global Prima Utama
AS18004,PT WIRELESS INDONESIA ( WIN )
AS18051,Pustekkom
AS18052,"Asiakomnet Multimedia, PT"
AS18056,Pt Mithaharum Abadi
AS18059,DTPNET NAP
AS18103,Neuviz Net
AS18112,PT. Sejuta Jaring Global
AS18153,PT Multidata Rancana Prima
AS18156,BITNET ISP AS
AS18351,"PT Media Akses Global Indo, Internet Provider Jakarta"
AS18355,PT. Dongsuh Securities
AS18365,"GRAMEDIA, PT."
AS18379,CSMNAP-ASN
AS18393,"Java Online, PT."
AS18394,Universitas Pendidikan Indonesia
AS199376,Adita Tarkono Putra
AS199459,Alexandro Setiawan
AS199592,WAHYU
AS199695,PT Anym Network Indonesia
AS199762,Adita Tarkono Putra
AS200051,RIZKI ABDUL AZIS
AS200135,PT Pabrik Gula Rajawali II
AS200160,Putu Paundrayana Waringin
AS200240,EKA SAPUTRA
AS200586,ahmad munir
AS201488,Ahmad Hanif Ihlasul Amal
AS201539,PT EGIDITYA NETWORK CENTER
AS202118,Luthfi Quartziosa Sulistiyo
AS203686,ILHAM MAULANA
AS203868,Rifqi Arief Pamungkas
AS203913,Nurohman
AS205018,Irsyad Khoirul Anwar
AS205422,Suheri
AS207571,Windhu Prasetia
AS210842,Rohmad Kurniadin
AS211338,Arif Awaludin
AS211407,PT Perwira Media Solusi
AS212001,Muhammad Fhandika Rafif
AS213293,Arif Setiawan
AS214028,Mahdi Umran Dzakwan Akmaludin
AS214488,Jajuli
AS214882,Hadi Santosa
AS215084,binsar yunus herdianton sirait
AS215171,PT Detroit Network Indonesia
AS215208,
AS215223,Mohammad Raska
AS215379,Chadinar Geraldi Purnama
AS215683,Ridwanulloh
AS215967,JK Maryono
AS216069,Djunardi Ali
AS216375,M Alhuda
AS23666,PT Sistelindo Mitralintas
AS23671,PT. Sarana InsanMuda Selaras
AS23679,PT. Media Antar Nusa
AS23692,Estiko Ramanda AS
AS23693,PT. Telekomunikasi Selular
AS23694,PT Iconmedia Lintas Nusantara
AS23695,ELGANET-ASN PT. Elga Yasa Media Internet Service
AS23696,PT Asia Utama.
AS23699,"IP Teknologi Komunikasi, PT."
AS23700,Linknet-Fastnet ASN
AS23756,PADINET - Padi Internet
AS23861,PT Mirae Asset Sekuritas Indonesia
AS23947,PT.Mora Telematika Indonesia
AS23948,Global Inti Corporatama PT.
AS23949,PT Comtronics Systems
AS23950,Generasi Indonesia Digital PT.
AS23951,PT JEMBATAN CITRA NUSANTARA
AS23952,Thamrin Telekomunikasi Network PT.
AS23953,PT ARTHA TELEKOMINDO
AS23954,PT. Bank Mandiri (Persero) Tbk.
AS24048,"Internet Systems Consortium, Inc."
AS24195,PT. Dhecyber Flow Indonesia
AS24198,PT. Datakom Padma Jaya (DatakomNAP)
AS24199,"Dini Nusa Kusuma, P.T."
AS24200,PT. Cakramedia Indocyber
AS24201,PT. Andalas Media Informatika
AS24202,PT. PASIFIKTEL INDOTAMA
AS24203,PT XL Axiata
AS24204,Satnetcom Balikpapan PT.
AS24205,PT. Bank Permata Tbk.
AS24206,PT Cakra Lintas Nusantara
AS24207,PT NettoCyber Indonesia
AS24209,PT. Inter Media Lintas Nusa
AS24210,Angkasa Sarana Teknik Komunikasi PT
AS24211,PT. Detik Ini JUga
AS24212,PT. JASNITA TELEKOMINDO
AS24213,PT. Arsen Kusuma Indonesia
AS24225,ABS/SMA-INDONESIA
AS24519,PT Kusuma Dinatha Jaya Abadi
AS24521,PT. DATA Utama Dinamika
AS24523,Orion Cyber Internet
AS24524,Pemerintah Daerah Provinsi Kalimantan Timur
AS24525,PT Solusi Aksesindo Pratama
AS24526,Bina Nusantara University
AS24527,PT Hanasta Dakara
AS24528,PT. Khasanah Teknologi Persada
AS24529,PT. Infotama Lintas Global
AS24530,PT. Power Telecom Indonesia
AS24532,PT. Inet Global Indo
AS24534,PT. Transhybrid Communication
AS24535,PT.Insan Sarana Telematika
AS24536,PT. Elektrindo Data Nusantara
AS24537,PT Paket Data Andal
AS24538,DIGITAL SATELLITE INDONESIA PT.
AS3382,University of Indonesia
AS38060,Biznet NAP - Internet Exchange Provider
AS38141,PT. Citramedia Network
AS38142,Universitas Airlangga
AS38143,"PT. Rabik Bangun Pertiwi, PMA"
AS38144,PT Jalawave Cakrawala
AS38145,PT. Panca Dewata Utama
AS38146,DIGITAL WIRELESS INDONESIA PT.
AS38147,PT. Inova Duapuluh Duapuluh
AS38148,QIANDRA INFORMATION TECHNOLOGY PT
AS38149,PT. Bakrie Telecom
AS38150,PT. TIME EXCELINDO
AS38153,Universitas Pelita Harapan
AS38154,PT. Pasifik Satelit Nusantara
AS38155,"Audianet Sentra Data, PT"
AS38156,PT. Union Routelink Communication
AS38157,Tentara Nasional Indonesia Angkatan Udara (TNI-AU)
AS38158,PT. Cyberindo Aditama
AS38162,PT DATA LAKE INDONESIA
AS38165,PT. AMBHARA DUTA SHANTI
AS38171,PT Bank Dananamon Indonesia Tbk
AS38211,PT. Mandiri Citra Makmur
AS38274,PT. Megaxus Infotech
AS38320,PT Maxindo Mitra Solusi
AS38331,Institut Teknologi Sepuluh Nopember
AS38482,Biznet ISP
AS38494,"PT. Bakrie & Brothers, Tbk"
AS38496,PT Cyber Network Indonesia
AS38498,203.31.164.0/23
AS38500,PT. Cross Network Indonesia
AS38501,PT Solusi Lintas Data
AS38502,PT. MULTI DATA PALEMBANG
AS38505,PT Graha Multimedia Nusantara
AS38506,PT Pika Media Komunika
AS38507,PT. Mitra Internet Tech
AS38508,PT. Cyberindo Aditama
AS38510,KEMENTERIAN PERTANIAN REPUBLIK INDONESIA
AS38511,PT Remala Abadi
AS38513,PT Aplikanusa Lintasarta
AS38515,"GRAHAMEDIA INFORMASI, PT."
AS38516,"Infokom Elektrindo, PT."
AS38517,PT.Bangsawan Cyberindo
AS38522,"Telindo Nusantara, PT"
AS38523,PT. SRIWIJAYA INTERNET SERVICES
AS38524,"Laxo Global Akses, PT"
AS38526,Dinas Komunikasi Informatika dan Persandian Kota Yogyakarta
AS38527,"JAWA POS NATIONAL NETWORK MEDIALINK, PT"
AS38567,PT. Rekayasa Industri
AS38750,"Telemedia Dinamika Sarana, PT"
AS38753,"Solusindo Bintang Pratama, PT"
AS38754,"PRIMEDIA ARMOEKADATA INTERNET, PT."
AS38755,Biro Statistics
AS38756,PT Bintang Komunikasi Utama
AS38757,PT INDONESIA COMNETS PLUS
AS38758,PT. HIPERNET INDODATA
AS38759,"TRANSMEDIA INDONESIA, PT"
AS38760,PT Media Sarana Akses
AS38761,PT. Sakti Putra Mandiri
AS38763,PT. Cyber Bintan
AS38764,MARKAS BESAR KEPOLISIAN REPUBLIK INDONESIA
AS38765,Departemen Energi dan Sumber Daya Mineral
AS38766,PT. Bumi Merbabu Permai
AS38767,PT Awan Media Semesta
AS38768,PT. Platinum Network Indonesia
AS38769,PT. Bit Technology Nusantara
AS38770,PT. Tangara Mitrakom
AS38771,PT Cyberplus Media Pratama
AS38772,PT. Smartlink Global Media.
AS38773,CiputraNet
AS38775,Indonesia SIRT
AS38777,PT. NTT Indonesia
AS38778,PT. Dutakom Wibawa Putra
AS38779,Badan Meteorologi dan Geofisika
AS38781,PT. Mitra Abdi Solusi
AS38783,PT. Simaya Jejaring Mandiri
AS38784,PT. Global Inti Corporatama
AS38785,PT. BORNEO BROADBAND TECHNOLOGY
AS38788,PT Indonesian Cloud
AS38896,PT. Centra Global Investama
AS4382,PT. Indonusa System Integrator Prima
AS4434,PT Rahajasa Media Internet
AS44817,M Alhuda
AS44822,PT GXT Network Link
AS45146,PT. Raja Sepadan Abadi
AS45147,PT. NAP Info Lintas Nusa
AS45286,PT EDI INDONESIA
AS45287,"Varnion Technology Semesta, PT"
AS45288,"KOMUNIKA LIMA DUABELAS, PT"
AS45289,"Indotrans Data, PT"
AS45291,PT Prima Telekom Indonesia
AS45293,Universitas Terbuka
AS45294,PT. Wanriau Indoxp
AS45295,PT. Cipta Informatika Cemerlang
AS45296,"Rabik Bangun Nusantara, PT"
AS45298,"INTERLINK TECHNOLOGY, PT"
AS45302,PT DES Teknologi Informasi
AS45304,"PetraNet, Surabaya, Indonesia"
AS45305,"Lintas Data Prima, PT"
AS45312,PT MEDIA LINTAS DATA
AS45313,"Dinas Perhubungan,komunikasi, informasi dan Telematika -NAD"
AS45314,"Medco E&P Indonesia, PT"
AS45315,PT POLARISNET
AS45316,Kantor Komunikasi Dan Informatika Kota Bogor
AS45317,"Jaringan Lintas Utara, PT"
AS45318,Institut Teknologi Sumatera
AS45319,Universitas Bhayangkara
AS45320,Departemen Komunikasi dan Informasi Republik Indonesia
AS45323,PT INTERLINK TECHNOLOGY
AS45324,"Global Media Teknologi, PT"
AS45325,PT PC24 Telekomunikasi Indonesia
AS45493,Biznet NAP - International Internet Exchange Provider
AS45658,SCTV Tower - Senayan City
AS45696,Pusat Pelaporan dan Analisis Transaksi Keuangan
AS45697,Universitas Surabaya
AS45700,PT Starlink Services Indonesia
AS45701,PT. Internet Madju Abad Milenindo
AS45702,PT JEMBATAN CITRA NUSANTARA
AS45703,Badan Koordinasi Penanaman Modal (BKPM)
AS45705,Universitas Gadjah Mada
AS45706,"Tele Globe Global, PT"
AS45707,"Prime Link Communication, PT"
AS45708,Pemerintah Kota Surabaya
AS45710,"Yudhawira Khatulistiwa, PT"
AS45711,Imediabiz Indonesia
AS45712,Departemen Luar Negeri Republik Indonesia
AS45713,PT. DEWATA TELEMATIKA
AS45715,PUSDATIN KEMHAN RI
AS45716,Cikarang Cyberindo PT.
AS45718,PT Juragan Online Solusi
AS45720,Lembaga Pengelola Dana Bergulir
AS45722,"Widya Intersat Nusantara, PT"
AS45723,"Omadata Indonesia, PT"
AS45724,"Multi Media Access, PT"
AS45725,"Kings Network Indonesia, PT"
AS45726,"Lion Mentari Airlines, PT"
AS45727,PT Indosat Ooredoo Hutchison
AS45730,"Aplikanusa Lintasarta, PT"
AS45731,"ARDH GLOBAL INDONESIA, PT"
AS45732,Pusat Sistem Informasi dan Teknologi Keuangan ( Pusintek )
AS45733,Center For International Forestry Research(CIFOR)
AS45734,PT Media Televisi Indonesia
AS45735,PT. UNINET MEDIA SAKTI
AS45770,Bagian Administrasi Pembangunan Pemerintah Kota Surabaya
AS45786,PT. Hawk Teknologi Solusi
AS46016,LKBN ANTARA
AS46017,Badan Koordinasi Survei dan Pemetaan Nasional (BAKOSURTANAL)
AS46018,Departemen Perindustrian Republik Indonesia
AS46019,Universitas Brawijaya
AS46020,"Orange Garden Indonesia, PT"
AS46023,PT Quantum Tera Network
AS46024,"PT. Bank Negara Indonesia (Persero), Tbk."
AS46025,PT. Cyberindo Aditama
AS46026,"BATAM BINTAN TELEKOMUNIKASI, PT"
AS46027,Direktorat Jenderal Pos dan Telekomunikasi (Dirjen Postel)
AS46029,PT. SEKAWAN GLOBAL KOMUNIKA
AS46030,PT Jastrindo Dinamika
AS46031,PT Telkom Satelit Indonesia
AS46032,PT Centrin Online Prima
AS46034,Departemen Kesehatan
AS46037,"Phillip Securities Indonesia, PT"
AS46039,Badan Pengawas Pasar Modal dan Lembaga Keuangan
AS46042,Gunadarma University
AS46044,Universitas Padjadjaran
AS46045,PT Sarana Pembangunan Siak
AS46047,Politeknik Negeri Sriwijaya
AS46048,PT Trimegah Securities Tbk
AS46049,Universitas Diponegoro
AS46050,PT JC Indonesia
AS46051,PT JEMBATAN CITRA NUSANTARA
AS46052,Politeknik Elektronika Negeri Surabaya
AS46054,PT Wahana Lintas Nusa Persada
AS46055,PT ROKA LANE ASIA
AS46056,PT Jovimaro Karya Agung
AS46057,Universitas Muhammadiyah Malang
AS46058,PT. Triwahana Gemasakti
AS46059,Universitas Negeri Malang
AS46061,PT. Adi Inti Mandiri
AS46063,PT.Graha Telekomunikasi Indonesia
AS46065,PT Indonesia Comnets Plus
AS4622,Indonesia Network Information Center
AS47311,PT Atharva Telematika Persada
AS4761,INDOSAT Internet Network Provider
AS4787,PT Cyberindo Aditama
AS4796,Institute of Technology Bandung
AS4800,PT Aplikanusa Lintasarta
AS4821,PT Sinergi Semesta Telematika
AS4833,PT. Gaharu Sejahtera
AS4855,Pacific Link Indonesia
AS55652,"Sumidhaz Permata Bunda, PT"
AS55653,"Skyline Semesta, PT"
AS55654,IAIN Surakarta
AS55655,PT. Saranainsan Mudaselaras
AS55656,Ministry of Transportation Republic of Indonesia
AS55661,PT Informasi Teknologi Indonesia
AS55662,CV. CITRAWEB NUSA INFOMEDIA
AS55664,PT Inovasi Global Mumpuni
AS55666,PT Media Sarana Data
AS55667,PT IP Telecom Multimedia Indonesia
AS55668,PT Jabar Telematika
AS55669,PT. Maxindo Content Solution
AS55670,PT. Universal Broadband
AS55672,Universitas Sanata Dharma
AS55673,Linknet-IDX ASN
AS55674,Universitas Negeri Yogyakarta
AS55676,PT. Garuda Media Telematika
AS55679,PT Hyperindo Media Perkasa
AS55680,Kantor Sistem Informasi Universitas Atma Jaya Yogyakarta
AS55683,CV Argon Data Interkoneksi
AS55684,Universitas Sebelas Maret
AS55685,PT Jala Lintas Media
AS55687,Universitas Tanjungpura
AS55688,PT. Beon Intermedia
AS55690,PT Andira Infomedia
AS55691,Universitas Multimedia Nusantara
AS55693,PT. Bangun Abadi Teknologi Indonesia
AS55694,Universitas Ciputra
AS55695,Universitas Islam Negeri Sunan Kalijaga Yogyakarta
AS55696,Starcom Solusindo PT.
AS55697,Universitas Sumatera Utara
AS55698,Infomedia Nusantara PT.
AS55699,PT. Cemerlang Multimedia
AS55700,Universitas Negeri Yogyakarta
AS55701,PT. Usaha Adisanggoro
AS55794,PT Lynx Mitra Asia
AS55818,MC-IX Matrix Internet Exchange RS-1
AS56060,PT ARTHA TELEKOMINDO
AS56233,PT Asia Teknologi Solusi
AS56234,PT Naraya Telematika
AS56235,PT KOMATSU INDONESIA
AS56236,Badan Narkotika Nasional
AS56237,Universitas Lampung
AS56238,PT. SURYAPUTRA ADIPRADANA
AS56239,PT Graha Anugrah Sejahtera
AS56240,PT DJARUM
AS56241,PT Telkom Satelit Indonesia
AS56243,Indonusa System Integrator Prima PT.
AS56245,PT Fajar Techno System
AS56246,PT Sumber Data Indonesia
AS56248,PT INDAH KIAT PULP & PAPER Tbk
AS56251,PT Acclivis Technologies and Solutions
AS56252,PT. Kreatif Pasific
AS56253,PT. Bank Tabungan Pensiunan Nasional Tbk
AS56254,UNIVERSITAS RIAU
AS56255,PT Transtech Communication Media
AS56256,Perpustakaan Nasional RI
AS56258,PT. PGAS TELEKOMUNIKASI NUSANTARA
AS56259,PT Astra Graphia Information Technology
AS56260,PT Pascal Indonesia
AS56261,Balai Telekomunikasi dan Informatika Perdesaan
AS58369,PT. Fiber Networks Indonesia
AS58375,Universitas Udayana
AS58376,PT Angkasa Komunikasi Global Utama
AS58377,"Sentra Niaga Solusindo, PT."
AS58378,Balai Telekomunikasi dan Informatika Perdesaan
AS58381,Wow Internet Indonesia
AS58383,PT Digital Komunikasi Lintas Sarana
AS58385,PT. Bank Syariah Mandiri
AS58387,Badan Pengawas Obat dan Makanan
AS58389,PT Sumber Data Indonesia
AS58390,PT. Faasri Utama Sakti
AS58392,PT. Sewiwi Indonesia
AS58394,Badan Pemeriksa Keuangan (BPK RI)
AS58395,PT. DUNIACATFISH KREATIF MEDIA
AS58396,PT. DEWATA TELEMATIKA
AS58397,PT Infinys System Indonesia
AS58398,PT. Indika Energy Tbk
AS58400,Universitas Negeri Semarang
AS58401,PT. DEWATA TELEMATIKA
AS58403,Bank Pembangunan Daerah DIY
AS58404,PT Qwords Company International
AS58449,PT Nusa Satu Inti Artha
AS58463,PT.PGAS TELEKOMUNIKASI NUSANTARA
AS58474,PT. MATRIXNET GLOBAL INDONESIA
AS58475,Universitas Lambung Mangkurat
AS58476,DIREKTORAT JENDERAL PAJAK
