ASN,Name
AS139428,PT.LEXXA DATA INDONUSA
AS139429,PT ARTATEL INDOKARYA
AS139430,PT. Media Nusantara Dinamis
AS139431,PT. Integrasi Jasa Nusantara
AS139432,Diskominfo Kab. Bogor
AS139433,PT Sakaeng Solata Infrastruktur
AS139435,PT SWADAYA TEKNO SOLUSI
AS139438,PT Pembangunan Sarana Telematika
AS139439,PT Perusahaan Pengelola Aset
AS139440,PT Tiga Putra Pandawa
AS139441,Pemerintah Kabupaten Belitung Timur
AS139442,KEMENTERIAN HUKUM DAN HAK ASASI MANUSIA
AS139443,Institut Teknologi Nasional Yogyakarta
AS139444,Universitas Jenderal Achmad Yani
AS139445,PT Adira Dinamika Multi Finance
AS139446,PT. Gonet Teknologi Indonesia
AS139447,PT Transportasi Jakarta
AS139448,PT Raharja Sinergi Komunikasi
AS139449,PT Lintas Data Multimedia
AS139451,PT SARANA INTI MAKMUR BERSAMA
AS139453,PT FASTRATA BUANA
AS139454,PT. KERETA COMMUTER INDONESIA (KCI)
AS139455,PT Mikro Mulia Agung Sentosa
AS139456,PT DEWAWEB
AS139457,PT Semut Data Indonesia
AS139458,PT Matahari Putra Prima
AS139459,Dinas Komunikasi dan Informatika Pemerintah Kota Probolinggo
AS139460,PT Maxindo Mitra Solusi
AS139640,PT Amana Digital Nusantara
AS139653,PT GUNUNG SUGIH BESAR NETWORK
AS139693,PT Timeplus Network Media
AS139742,PT Ryndo Jaringan Nusantara
AS139838,PT Sabungan Marshal Tama
AS139932,DINAS KOMUNIKASI DAN INFORMATIKA KABUPATEN KARAWANG
AS139934,PT Skynet Network Bersama
AS139935,RSU DR. SOETOMO
AS139937,PT Nararya Global Network
AS139938,PT Bintang Global Abadi
AS139939,Institut Seni Budaya Indonesia Bandung
AS139940,Dinas Komunikasi dan Informatika Kabupaten Sampang
AS139941,RIYAD NETWORK
AS139942,Dinas Komunikasi dan Informasi Kabupaten Batang
AS139943,Dinas Komunikasi dan Informatika Kabupaten Garut
AS139945,Pemerintah Kabupaten Purbalingga
AS139946,PT. Teknologi Bumi Nusantara
AS139948,Dinas Komunikasi dan Informatika Kota Banjarbaru
AS139949,PT. Bintang Kejora Teknologi
AS139950,Arsip Nasional Republik Indonesia
AS139951,PT Alfatih Indo Teknologi
AS139952,PT Trisari Data Indonusa
AS139955,PT DATA PRIMA SOLUSINDO
AS139957,Dinas Komunikasi Informatika dan Statistik Provinsi Lampung
AS139958,PT Fakta Jabbar Industri
AS139959,Universitas Pembangunan Nasional 'Veteran' Jakarta
AS139962,PT.Bestcamp Prima Data
AS139963,PT.MURNI MAKMUR ABADI
AS139967,PT. Yasmin Amanah Media
AS139969,PT JUNINDO
AS139970,Batam Internet Exchange
AS139971,PT. Medialink Intercontinental
AS139972,PT. Putra Lebak Banten
AS139973,Pemerintah Kabupaten Muara Enim
AS139974,Universitas Muria Kudus
AS139977,PT PRISMA MEDIA NUSANTARA
AS139978,PT Jaringan Rtrwnet Nusantara
AS139979,"PT. Enseval Putera Megatrading, Tbk"
AS139980,Dinas Komunikasi Informasi Kota Tasikmalaya
AS139981,PT. Menaksopal Link Nusantara
AS139982,PT Buana Visualnet Sentra
AS139983,PT. Borneo Cakrawala Media
AS139984,PT Indomedia Solusi net
AS139985,Dinas Komunikasi dan Informatika Kab. Hulu Sungai Tengah
AS139986,PT. HENAN PUTIHRAI SEKURITAS
AS139988,PT. GARUDA PRIMA INTERNETINDO
AS139989,CV Atha Media Prima
AS139992,Dinas Komunikasi dan Informatika Pemerintah Kabupaten Cilacap
AS139993,PT. FORIT ASTA SOLUSINDO
AS139994,PT XL Axiata Tbk
AS139995,PT. Akashia Thuba Jaya
AS139996,DINAS KOMUNIKASI DAN INFORMATIKA KABUPATEN TABANAN
AS139997,PT Wortel
AS139998,Universitas Islam Riau
AS140002,KANTOR KESEHATAN PELABUHAN KELAS II SEMARANG
AS140003,Rumah Sakit Umum Pusat DR Hasan Sadikin
AS140004,DINAS KOMUNIKASI INFORMATIKA DAN STATISTIK KOTA BLITAR
AS140006,RSUP DR KARIADI
AS140007,PT. DANKOM MITRA ABADI
AS140008,PT Inti Media Teknologi
AS140009,PT. Riau Satu Net
AS140010,INSTITUT AGAMA ISLAM NEGERI PURWOKERTO
AS140012,PT Dewata Solusi Tehnologi
AS140014,KEMENTERIAN PARIWISATA DAN EKONOMI KREATIF
AS140015,Politeknik Negeri Indramayu
AS140016,PT Trik Media Data
AS140018,PT. CYBER TEKNOLOGI PUTRAWAN
AS140019,Universitas Advent Indonesia
AS140020,PT. Klik Indomaret Sukses
AS140022,Pemerintah Daerah kabupaten Hulu Sungai Utara
AS140023,Dinas Komunikasi dan Informatika Kota Madiun
AS140024,PT Pelabuhan Indonesia III (Persero)
AS140025,INSTITUT AGAMA ISLAM NEGERI (IAIN) PONOROGO
AS140026,PT. KUPANG INTERMEDIA
AS140028,PT Brahmayasa Sejahtera Abadi
AS140029,DIREKTORAT BINA TEKNIK SUMBER DAYA AIR
AS140030,DINAS KOMUNIKASI DAN INFORMATIKA KABUPATEN PEKALONGAN
AS140031,PT Mandala Lintas Nusa
AS140101,PT Skylink Sinaya Sejahtera
AS140304,PT Prima Karya Pradita
AS140384,PT BITNIAGA CIPTA GEMILANG
AS140385,PT Inti Tech Indonesia
AS140386,PUSAT PENGELOLAAN DANA PEMBIAYAAN PERUMAHAN (PPDPP)
AS140387,PT. Multi Terminal Indonesia
AS140388,ARKANA
AS140389,PT Dewa Bisnis Digital
AS140390,PT BUROQ SARANA INFORMATIKA
AS140391,PT. Ebdesk Teknologi
AS140392,PT Java United Services
AS140394,DIREKTORAT JENDERAL KEKAYAAN INTELEKTUAL KEMENTERIAN HUKUM DAN HAM REPUBLIK INDONESIA
AS140395,PT RADNET DIGITAL INDONESIA
AS140396,PT. PANDU PALAPA TELEMATIKA
AS140398,Diskominfo Kab. Natuna
AS140399,PT Parsaoran Global Datatrans
AS140401,PT Proxi Jaringan Nusantara
AS140403,PT. Graha Fatta
AS140404,PT TERABYTE INDONESIA
AS140405,PT. Cybertechtonic Pratama
AS140406,Pemerintah Kabupaten Bolaang Mongondow
AS140407,KitaNet
AS140409,PT Berlian Sistem Informasi
AS140410,Politeknik Negeri Lampung
AS140411,UNIVERSITAS PARAMADINA
AS140413,PT. GAYUH MEDIA INFORMATIKA
AS140415,PT JASAMARGA TOLLROAD OPERATOR
AS140416,PT TRANS TELEKOMUNIKASI INDONESIA
AS140417,PT Indotechno Digital Komputasi
AS140421,PT APLIKA DATA NUSANTARA
AS140423,PT Chandra Media Nusantara
AS140424,DINAS KOMUNIKASI INFORMATIKA STATISTIK DAN PERSANDIAN PROVINSI SULAWESI SELATAN
AS140425,DINAS KOMUNIKASI DAN INFORMATIKA KABUPATEN DEMAK
AS140426,Pemerintah Kabupaten Klungkung
AS140427,PT Perkebunan Nusantara IV (PTPN IV)
AS140428,PT Pancaran Samudera Transport
AS140429,PT. MEDIA DISTRIBUSI PRIMA
AS140430,PT Zoom Infotek Telesindo
AS140431,Dinas Komunikasi dan Informatika Kabupaten Wonogiri
AS140433,PT. Colo Media Netindo
AS140436,DINAS KOMUNIKASI DAN INFORMATIKA PEMERINTAH KOTA TANJUNGBALAI
AS140437,PT MEDIA MANAKARRA NET
AS140439,Badan Pendapatan Daerah Provinsi Jawa Barat
AS140442,PT Nusantara Teknologi Semesta
AS140443,PT Herza Digital Indonesia
AS140444,Universitas Binawan
AS140445,PT Satu Nusa Bangsa
AS140446,PT Kingpolah Network Solutions
AS140448,PT Acces Prima Nusantara
AS140449,PT Media Cloud Indonesia
AS140452,PT Jaya Media Expres
AS140454,PT Pop Net Indonesia
AS140455,Dinas Komunikasi dan Informatika Kota Samarinda
AS140456,PT Era Awan Digital
AS140457,PT Ikhlas Cipta Teknologi
AS140458,Dinas Komunikasi Informatika Statistik dan Persandian Kota Palangka Raya
AS140459,PT Mikrotik Indonesia Streaky
AS140460,PT Nitnet Media Teknologi
AS140463,Sekolah Tinggi Teknologi Kedirgantaraan Yogyakarta
AS140464,PT Widara Media Informasi
AS140465,PT Andalas Global Network
AS140467,PT Kreatif Global Solusindo
AS140469,PT Wahyu Adidaya Network
AS140470,PT Andalan Dinamika Informatika
AS140472,PT Dinamika Karya Adicita
AS140475,PT Citra Celebas Multimedia
AS140476,PT Ardi Jaya Solusindo
AS140477,PT Zigma Teknologi Indonesia
AS140478,PT Hijrah Muara Sintesis
AS140479,PT Inditech Global Network
AS140480,Institut Teknologi Kalimantan
AS140481,PT Tonggak Teknologi Netikom
AS140482,IdeaNet
AS140940,PT Bank Seabank Indonesia
AS140946,PT Lintas Cita Nusantara
AS140966,Dinas Komunikasi dan Informatika Kabupaten Situbondo
AS141048,Dinas Komunikasi Dan Informatika Kabupaten Kuningan
AS141049,PT Profesional Internet Indonesia
AS141050,PT Sinde Budi Sentosa
AS141052,Institut Agama Islam Negeri Metro
AS141053,Pemerintah Kabupaten Wonosobo
AS141054,PT Marva Informatika Solusindo
AS141055,Sekolah Tinggi Teknik - PLN
AS141056,PT IOSYS Media Data
AS141057,PT Fokus Inovasi Faradisa Abadi
AS141058,Pemerintah Kabupaten Soppeng
AS141059,Yayasan Pembina Potensi Pembangunan
AS141061,Pemerintah Kabupaten Lima Puluh Kota
AS141062,PT Mulkan Sarana Solusi
AS141064,PT Network Lintas Fiberindo
AS141065,PT Arozak Bima Yudho Sangkara
AS141066,Pemerintah Kabupaten Samosir
AS141067,PT Trisula Media Data
AS141068,KORLANTAS POLRI
AS141069,PT Batanghari Baik Net
AS141070,PT Komputasi Awan Karya Anak Bangsa
AS141071,PT Jembatan Data Pangrango
AS141073,PT Juragan Wifi Indonesia
AS141074,PT Signal Indo Sukses
AS141075,PT Satu Visi Kreasi Indonesia
AS141076,PT. Arthamas Cipta
AS141077,RSTNET
AS141078,PT Amanna Media Link
AS141081,PT Indo Access Semesta
AS141082,PT Trika Global Media
AS141083,PT Filltech Antar Nusa
AS141084,PT Chacha Networking System
AS141085,Dinas Komunikasi Dan Informatika Kabupaten Subang
AS141086,Komisi Nasional Hak Asasi Manusia RI
AS141087,PT Karya Panca Telekomunikasi
AS141088,Politeknik Pelayaran Sumatera Barat
AS141089,Pemerintah Provinsi Kalimantan Utara
AS141090,PT Mulia Frekuensi Adyatama
AS141091,PT Skynet Lintas Nusantara
AS141093,PT Media Data Lintas Nusantara Bersatu
AS141095,Universitas PGRI Jombang
AS141097,PT Lintas Citra Abadi
AS141098,PT Multimedia Link Technology
AS141101,PT Makara Mas
AS141103,PT Sekar Solusi Abadi
AS141105,PT Dapur Remaja Multi Sarana
AS141107,PT Linkgo Metro Teknologi
AS141108,Universitas Islam Negeri Sultan Maulana Hasanudin Banten
AS141109,PT Omni Cloud Indonesia
AS141110,PT Jumpa Daring Indonesia
AS141113,Komisi Yudisial RI
AS141114,PT Super Media Indonesia
AS141116,PT Riyozha Telekomunikasi Indonesia
AS141120,PT Warna Data Multimedia
AS141122,PT Aneka Siak Nusantara
AS141123,PT Puskomedia Indonesia Kreatif
AS141124,Dinas Komunikasi dan Informatika Kota Makassar
AS141125,PT Radmila Pratama Multireka
AS141126,PT Cubiespot Pilar Data Nusantara
AS141127,PT Anugerah Cimanuk Raya
AS141128,PT Sarva Solution Indonesia
AS141129,PT Lintas Teknologi Tanpa Batas
AS141130,PT Dinar Wahana Gemilang
AS141131,PT Komatsu Undercarriage Indonesia
AS141133,Yayasan Pendidikan Islam Ibn Khaldun
AS141134,PT Vissie Cyber Data
AS141135,Institut Pemerintahan Dalam Negeri
AS141137,PT Media Cepat Indonesia
AS141138,PT Bank Sumut
AS141139,PT Chandela Lintas Media
AS141140,PT Jinde Grup Indonesia
AS141142,PT PC24 Telekomunikasi Indonesia
AS141144,PT Cahaya Maparada Nusantara
AS141145,PT Giga Digital Nusantara
AS141146,PT Indonesia Telekomunikasi Teknologi
AS141147,PT Arkananta Global Media
AS141350,PT Trixia Network Indonesia
AS141376,PT Shafanza Cahaya Utama
AS141576,Ombudsman Republik Indonesia
AS141578,Universitas Pancasila
AS141579,PT Pundi Mas Berjaya
AS141580,PT Muba Network Connection
AS141581,PT Asma Mitra Global
AS141583,BLDK Mahkamah Agung
AS141584,PT Jetorbit Teknologi Indonesia
AS141585,PT Data Digital Indotama
AS141587,PT Pembayaran Digital Nusantara
AS141588,PT Natakarya Mediatama
AS141589,CV Epenthink Papua
AS141590,PT Tujuh Media Angkasa
AS141592,PT Infonet Nusa Solusindo
AS141594,Diskominfo Karangasem
AS141595,PT Akbar Prima Media
AS141596,PT Wistel Teknologi Solusi
AS141600,PT Viriya Surya Abadi
AS141602,PT Inovasi Teknologi Pintar
AS141603,Pemerintah Kota Palu
AS141606,PT Sembilan Mediadata Nusaraya
AS141607,PT Gayatri Lintas Nusantara
AS141609,PT Celebes Askara Telemedia
AS141610,PT Nusa Data Multimedia
AS141612,PT Mukti Dua Bersama
AS141613,PT Jaringan Internet Nusantara
AS141614,PT Manajemen Data Corpora
AS141615,PT Integrasi Perkasa Mandiri
AS141616,PT Orbit Eka Semesta
AS141617,PT Topindo Solusi Komunika
AS141618,PT Asia Central Telematika
AS141620,CV Linkmedia Nusantara
AS141621,PT Galuh Multidata Solution
AS141622,PT Java Media Grup
AS141623,PT Registrasi Neva Angkasa
AS141625,Direktorat Jenderal Pendidikan Islam
AS141626,PT Sandya Sistem Indonesia
AS141627,PT Media Solusi Network
AS141628,PT Sapu Lintas Digital
AS141630,PT.OMEGA MEDIA GLOBAL
AS141633,Universitas Halu Oleo
AS141634,PT Satu Sistem Integrasi
AS141635,Universitas Islam Negeri Kiai Haji Achmad Siddiq Jember
AS141636,PT Mega Data Perkasa
AS141637,PT Panca Budi Niaga
AS141638,Yayasan Lembaga Pengembangan Perbankan Indonesia
AS141639,PT Lintas Satu Visi
AS141640,Lembaga Penjamin Simpanan
AS141641,Pemerintah Provinsi Sumatera Barat
AS141642,PT Ring Media Nusantara
AS141643,Dinas Komunikasi dan Informatika Kabupaten Kendal
AS141644,Dinas Komunikasi dan Informatika Kabupaten Blora
AS141645,PT Pratama Asia Globalindo
AS141646,Dinas Komunikasi dan Informatika Kabupaten Karanganyar
AS141647,PT Graha Layar Prima
AS141648,PT Indo Prima Akses
AS141649,Institut Agama Islam Negeri Madura
AS141650,PT. JASA RAHARJA (PERSERO)
AS141652,PT Nugraha Utama Teknologi
AS141653,PT Kafilah Intermedia Nusantara
AS141655,Pemerintah Kabupaten Ogan Ilir
AS141656,Pemerintah Daerah Kabupaten Karo
AS141657,Dinas Komunikasi Informatika dan Statistika Kabupaten Brebes
AS141659,Badan Nasional Penanggulangan Bencana
AS141660,PT Wahyu Akses Koneksi Riau
AS141662,PT Neo Fiber Teknologi
AS141663,PT Microcel Pole Indonesia
AS141664,PT Jaringan Inti Exadata
AS141665,PT Cahaya Artha Daya
AS141666,PT Industri Kereta Api (INKA)
AS141667,PT Amboro Integrasi Teknologi Inovasi
AS141669,PT Citra Victoria Raya
AS141671,PT Samudera Kilat Indonesia
AS141672,PT Nuansa Online Mitrakom
AS141673,PT Mamura Inter Media
AS141674,PT Data Arta Sedaya
AS141675,PT Madina Solusi Indonesia
AS141887,PT Terra Sigma Solusi
AS141889,PT Solusi Media Telekomunikasi
AS141890,PT Condifa Digitech Solusindo
AS141891,PT Lima Satu Tiga Global Tel-Access
AS141892,CV Andhika Pratama Sanggoro
AS141893,PT Kawanua Internet Indonesia
AS141896,PT Delta Surya Solusitama
AS141897,PT Ekagrata Data Gemilang
AS141898,PT Milenial Inti Telekomunikasi
AS141899,PT Malfi Karya Berkah
AS141901,PT Solusi Jasa Teknologi
AS141902,PT Jawa Provider Telematika
AS141903,PT Natha Buana Indonesia
AS141905,PT Korea Investment And Sekuritas Indonesia
AS141906,PT KB Finansia Multi Finance
AS141907,PT Metrosolusi Teknologi Indonesia
AS141909,PT Aditama Netmedia Solusindo
AS141910,PT Fivendro Mandiri Indonesia
AS141911,Dinas Komunikasi dan Informatika Kabupaten Bangkalan
AS141912,Dinas Komunikasi dan Informatika Kabupaten Bondowoso
AS141913,PT Global Media Telekomunikasi Network
AS141916,PT Bantani Media Utama
AS141917,PT Muria Data Utama
AS141918,PT DesktopIP Teknologi Indonesia
AS141920,PT Andal Berjaya Infomedia
AS141921,PT Jaringan Keluarga Bersama
AS141922,PT Agsa Global Network
AS141927,PT Jaringan prima indonesia
AS141928,PT Balian Media Online Nusantara
AS141929,PT Daniswara Citra Informatika
AS141930,PT Galunggung Access Solutions
AS141931,PT Pamapersada Nusantara
AS141933,PT Solusi Internet Desa
AS141934,PT Sanders Bersaudara Media
AS141935,PT Cipta Data Global
AS141936,STIE YKPN Yogyakarta
AS141937,PT Aulia Sentral Multidata
AS141939,PT Chayo Anugrah Teknologi
AS141940,PT Hens Global Network
AS141941,PT Regynet Data Solusindo
AS141943,PT Berlian Media Teknologi
AS141944,Badan Pembinaan Ideologi Pancasila
AS141945,PT Hydra Media Indonesia
AS141947,PT Loveika Host Nusantara
AS141948,Dinas Komunikasi dan Informatika Kabupaten Tanah Laut
AS141950,PT Cybermantra Perkasa Sumberarta
AS141951,Politeknik Harapan Bersama Tegal
AS141952,PT Link Kita Teknologi
AS141953,PT BRI Danareksa Sekuritas
AS141955,PT Timor Lintas Nusantara
AS141957,PT Lancar Jaya Network
AS141958,Kementerian Pemuda dan Olahraga
AS141959,PT Arta Flash Sintesa Nusantara
AS141960,PT Pelangi Communication Network
AS141961,PT Traharja Utama Mandiri
AS141965,Diskominfo Kota Pasuruan
AS141966,PT Instanet Media Nusantara
AS141967,Institut Agama Islam Negeri Salatiga
AS141968,PT Industri Kreatif Digital
AS141969,PT Langgeng Jaya Nusaraya
AS141970,PT Jelajah Data Semesta
AS141972,Pemerintah Kota Pariaman
AS141973,PT Net Grup Multimedia
AS141974,PT Teknologi Rubi Mandriva
AS141975,PT Rubyan Network Solution
AS141976,Dinas Komunikasi dan Informatika Kabupaten Jepara
AS141977,PDAM Bandarmasih Kota Banjarmasin
AS141978,PT Akses Bersama Sedaya
AS141981,Institut Transportasi dan Logistik Trisakti
AS141982,PT Kataji Nukami Indonesia
AS141983,PT Rajeg Media Telekomunikasi
AS141984,PT Fajar Lestari Anugrah Sejati
AS141985,PT Argon Internet Amariqindo
AS141986,PT Cahaya Sinergi Semesta
AS142043,PT BARAYA BARENG SADULUR
AS142145,PT MUSUBI BALI INTERKONEKSI
AS142166,PT Hyperscale Data Network
AS142170,PT Satu Data Indonesia
AS142171,Yayasan As Syifa Al Khoeriyyah
AS142183,PT Juragan Multimedia Global
AS142184,PT Lintaslink Media Teknologi
AS142188,PT Aryaka Lintas Media
AS142189,PT Teja Bala Abadi
AS142190,PT Slopa Solusi Netikom
AS142193,PT Turbo Network Indonesia
AS142198,PT GIRADZ MEDIA NUZANTRHA
AS142201,PT Axindo Infinitas Network
AS142212,"Dinas Komunikasi, Informatika, Statistik dan Persandian Kabupaten Kotawaringin Barat"
AS142214,PT Fivestar Teknologi Nusantara
AS142216,PT Tridata Network Indonesia
AS142219,PT Media Akses Prima
AS142220,PT Citalang Digital Network
AS142221,PT Fazznet Zetta Indonesia
AS142226,"Dinas Komunikasi, Informatika, Statistik dan Persandian Kabupaten Kaimana"
AS142230,PT Bahari Nusantara Network
AS142231,Institut Sains dan Teknologi Terpadu Surabaya
AS142236,PT SKY NETWORKS NUSANTARA
AS142238,PT Josu Global Teknologi
AS142243,PT Asuransi Jiwa IFG
AS142257,PT Kevin Cahaya Nusantara
AS142258,PT Pesona Network Mediautama
AS142264,PT SKY BASE TECHNOLOGHY DIGITAL
AS142304,PT Karunia Sinergi
AS142305,PT Globus Melia Indotama
AS142307,PT CYB Media Group
AS142308,PT Whiz Digital Berjaya
AS142310,PT Bina Informatika Solusindo
AS142311,PT Jayanet Technology Nusantara
AS142312,PT Wget Solusindo Pratama
AS142313,PT Buana Eksplorasi Solusi
AS142314,Dinas Komunikasi Informatika Persandian dan Statistik Kabuapten Bueleleng
AS142315,TORSADA
AS142316,Dinas Komunikasi dan Informatika Pemerintah Kabupaten Jembrana
AS142317,PT Cover Network Indonesia
AS142318,PT Lancar Berkah Barokah
AS142319,PT Telemedia Komunikasi Pratama
AS142320,Universitas Islam Negeri Sumatera Utara Medan
AS142321,PT Lintang Samoan Network
AS142322,PT Kaf Media Nusantara
AS142324,PT Nervelink Utama Media
AS142326,PT Fahasa Tri Data
AS142327,PT Internet Prima Nusantara
AS142329,Universitas Palangkaraya
AS142330,Dinas Komunikasi dan Informatika Kabupaten Lombok Tengah
AS142331,PT Boombas Carlo Medianet
AS142332,Telnet Indonesia
AS142333,PT Triguna Akses Teknologi
AS142334,Disdukcapil Kota Bandung
AS142335,GARNET
AS142336,Politeknik ATI Padang
AS142338,PT Neo Santara Solusi
AS142339,PT Kangen Network Solusindo
AS142340,PT Lancar Artha Media Data
AS142341,PT Alfa Omega Interkoneksi
AS142342,PT Media Akses Data
AS142343,Dinas Kominfo Kabupaten Rembang
AS142345,PT Digital Gemilang Solusi
AS142347,PT Sarana Media Cemerlang
AS142348,Universitas Pakuan
AS142349,Dinas Komunikasi dan Informatika Kabupaten Mojokerto
AS142350,PT Skala Jaringan Indonesia
AS142351,PT Global Inayah Elektrindo
AS142352,PT. PRATAMA HASTA UTAMA SOLUSINDO
AS142354,PT Superspace Teknologi Indonesia
AS142355,PT Falah Sistem Integrasi
AS142356,PT Aderani Multi Akses
AS142359,PT Bina Pertiwi
AS142360,PT Internet Mulia Untuk Negeri
AS142361,PT Razanet Infotama Mandiri
AS142362,PT Sukma Sejati Media
AS142363,RSUP Prof Kandou
AS142364,PT Subnet Data Nusantara
AS142365,PT Rezky Sukabumi Vision
AS142366,PT Relabs Net Daya Cipta
AS142367,Institut Teknologi Del
AS142368,PT Global Data Akses Persada
AS142369,PT Mega Data Akses
AS142370,PT Master Star Network
AS142373,PT Multi Network Indonesia
AS142374,PT Solusi Integra Datakom
AS142375,PT Hayat Teknologi Informatika
AS142379,PT. INDONESIA SUPER CORRIDOR - DATA CENTER
AS142381,PT Media Access Telematika
AS142382,PT Klinik Digital Indonesia JNHOST
AS142383,PT Vaiotech Lintas Nusantara
AS142384,Dinas Komunikasi Dan Informatika Kabupaten Jember
AS142385,PT Berkat Internet Perkasa
AS142386,PT JARINGAN LINTAS ARTHA
AS142387,PT Integrasi Jaringan Ekosistem
AS142388,PT Maybank Kim Eng Sekuritas
AS142389,IKI INDONESIA
AS142390,PT Abs Multimedia Indonesia
AS142391,PT Anugerah Panca Laksana
AS142392,PT Netlink Lintas Data
AS142393,PT Media Solusi Sukses
AS142394,PT Cahaya Solusindo Internusa
AS142395,PT Global Internet Indonesia
AS142396,PT Pelayanan Listrik Nasional (PLN) Batam
AS142397,Politeknik Negeri Bali
AS142398,PT Digital Akses Nusantara
AS142399,PT Zona Kolektif Indonesia
AS142400,PT Inovasi Digital Telekomunikasi
AS142401,PT Inter Koneksi Media
AS142544,PT Data net Support
AS142566,PT Latansa Media Telekomunikasi
AS142639,PT Qalby Cahaya Network
AS147072,PT Bank BTPN Syariah Tbk
AS147076,PT Ade Angelin Mulya
AS147077,Pemerintah Kabupaten Kubu Raya
AS147078,PT Serayu Multi Connection
AS147080,PT Paxcyber Sekuriti Indonesia
AS147081,PT Pusat Net Media
AS147082,PT Net Sun Power
AS147084,PT Anum Nusantara Media
AS147086,PT Global Teknologi Net
AS147087,PT Jaringan Internet Banten
AS147088,PT Skynet Indonesia Madani
AS147089,PT Intergate Cahaya Media
AS147090,PT Lestari Exellika Barokah
AS147091,PT Global Jet Express
AS147092,Institut Agama Islam Negeri Kendari (IAIN KENDARI)
AS147093,PT Pasifik Wija Teknologi
AS147094,PT. MITRA VISIONER PRATAMA
AS147095,PT Angkasa Bintan Cemerlang
AS147096,PT Jaya Sejahtra Nugraha
AS147097,PT Jangkau Lintas Nusantara
AS147100,PT Buyas Media Teknologi Nusantara
AS147101,AeroNet by PT Lintas Teknologi Solusindo
AS147103,Universitas Muhammadiyah Metro
AS147104,PT Isuzu Astra Motor Indonesia
AS147105,PT Paragon Technology and Innovation
AS147106,PT Global Erasiber Teknologi
AS147109,PT Internet Keluarga Indonesia
AS147113,PT Eyza Kausa Sinergi Abadi
AS147117,PT Blackfaos Data Nusantara
AS147118,PT Ameera Mega Buana
AS147119,Politeknik Pariwisata Makassar
AS147120,PT Myarsyila Indonesia Interkoneksi
AS147121,PT Marva Global Telekomunikasi
AS147122,PT Uliz Netmedia Solusindo
AS147124,PT Hostingan Awan Indonesia
AS147126,PT Patra Sinar Teknologi
AS147127,PT Tujuhlangit Lintas Nusantara
AS147128,PT Era Digital Media
AS147129,Universitas Aisyiyah Surakarta
AS147130,PT Mintanet Data Nusantara
AS147131,PT Global Sarana Elektronika
AS147132,PT Mafianet Akses Media
AS147133,PT Jafati Mitra Solusindo
AS147134,PT IndoWebhost Kreasi
AS147135,PT Swajasa Lintas Media
AS147136,Dinas Komunikasi dan Informasi Kabupaten Sragen
AS147137,PT Helium Sinergi Telekomunikasi
AS147138,PT Angkasa Pura Sarana Digital
AS147139,PT Diva Telekomunikasi Indonesia
AS147140,PT Hijrah Mandiri Network
AS147141,PT Mitra Internet Indonesia
AS147142,PT Sarana Telemedia Nusantara
AS147143,PT Palu Pasundan Media Net
AS147145,PT Jalur Satu Aman
AS147150,PT Hasya Mitra Komunika
AS147152,PT Asli Isoae Solusine
AS147154,PT Pass Internet Indonesia
AS147155,PT Gateway Internet Indonesia
AS147157,Universitas Merdeka Malang
AS147159,PT Beibi Cemerlang Indonesia
AS147160,Badan Pengelola Keuangan Haji
AS147161,Universitas Muhammadiyah Gresik
AS147163,PT Sunvone Solusindo
AS147164,PT Nalendra Gigantara Media
AS147165,PT Amerta Asa Media
AS147168,PT NTT Indonesia
AS147170,Dinas Komunikasi Informatika dan Statistik Kota Banjarmasin
AS147171,Badan Riset dan Inovasi Nasional
AS147173,PT Dipa Data Telekomunikasi
AS149176,Institute of Technology Bandung
AS149315,PT Solnet Indonesia
AS149316,PT Jaring Solusi Persada
AS149318,PT Rezeki ASA Cemerlang
AS149319,PT Trisna Mega Abadi
AS149320,PT Adhi Pradana Makayasa
AS149321,PT Cakrawala Media Data
AS149322,PT Royal Assetindo
AS149324,PT Prosperita Mitra Indonesia
AS149325,Universitas Wahid Hasyim
AS149326,Politeknik Negeri Madura
AS149327,PT Corbec Communication
AS149329,Universitas Islam Internasional Indonesia
AS149332,PT Optimus Teknologi Pro
AS149333,PT Primadona Media Digitalindo
AS149334,PT Mitra Andalan Nusa
AS149335,PT Gogiga Media Teknologi
AS149337,PT Belopa Kreatif Indonesia
AS149339,PT Sriboga Flour Mill
AS149340,PT Digital Hasanah Indonesia
AS149341,Politeknik Negeri Cilacap
AS149342,Pemerintah Daerah Kabupaten Tasikmalaya
AS149344,Dhoho ISP
AS149345,PT Karya Aneka Persada
AS149346,Dinas Komunikasi dan Informatika Kota Pangkalpinang
AS149350,PT Pusaka Kreasi Mandiri
AS149353,PT Selaras Citra Artmedia
AS149354,PT Sasa Inti
AS149357,PT Ultra Mandiri Telekomunikasi
AS149358,Universitas Islam Negeri Antasari Banjarmasin
AS149359,PT Persada Data Multimedia
AS149360,PT Indo Telemedia Solusi
AS149363,Badan Pengawasan Keuangan dan Pembangunan
AS149364,PT. AwanBit Data Indonesia
AS149365,PT Java Kreasindo Bersama
AS149366,Poltekkes Kemenkes Surabaya
AS149368,PT Bentang Johar Awal
AS149369,PT Dekadata Lingkar Nusantara
AS149371,PT Cakrawala Sarana Solusindo
AS149372,Institut Agama Islam Negeri Bukittinggi
AS149373,PT Rintis Berkah Akamila
AS149374,PT Alam Media Data
AS149375,Dinas Komunikasi Informatika Persandian dan Statistik Kabupaten Serang
AS149377,PT Komit Kreasi Indonesia
AS149379,PT Kayangan Media Lombok
AS149381,Dinas Komunikasi dan Informatika Kabupaten Tulungagung
AS149383,PT Mutiara Cahaya Raya Net
AS149384,Dinas Komunikasi dan Informatika Kabupaten Tabalong
AS149385,PT Agung Network Solution
AS149388,Pemerintah Kota Gorontalo
AS149391,PT Delta Awan Angkasa
AS149392,PT Hopnet Tunel Integrasi
AS149393,PT Solusi Data Cepat
AS149394,PT Gonet Mandiri Teknologi
AS149395,RSUD Tidar Magelang
AS149397,Universitas Khairun
AS149398,PT Jaringan Multimedia Global
AS149399,PT Sentra Awan Maxima
AS149400,PT Cyber Akses Indonesia
AS149401,PT Sintesa Sinergi Nusantara
AS149402,Diskominfo Pemerintah Kabupaten Probolinggo
AS149404,PT Cepat Multi Data
AS149405,PT Multi Karya Athira
AS149407,PT Sun Star Motor
AS149408,PT Mutiara Bintang Abadi
AS149409,PT Core Digital Network
AS149411,PT Praweda Sarana Informatika
AS149412,PT Centris Data Indonesia
AS149413,Dinas Komunikasi Informatika dan Persandian Kabupaten Bangli
AS149661,PT Pricom Media Solusi
AS149662,PT Hostnet Data Global
AS149663,PT Palemnet Multimedia Data Perkasa
