ASN,Name
AS10089,Total Access Communication PLC.
AS10227,Institute Rajabhat Suandusit
AS131089,National Telecom Public Company Limited
AS131090,National Telecom Public Company Limited
AS131162,Internet Service Provider in Thailand
AS131221,Petchaburi Rajabhat University
AS131246,"LOEI university network ,LOEI, Thailand"
AS131257,"Suratthani ratjabhat university, Thailand"
AS131293,TOT Public Company Limited
AS131445,Advance Wireless Network
AS131447,POPIDC powered by CSLoxinfo
AS131460,9 UM Tower
AS131789,"Asahi Kasei International IT Asia Pacific Co., LTD"
AS132009,"True Internet Co., Ltd."
AS132013,True Internet assigned for ICS
AS132032,Total Access Communication PLC.
AS132061,Realmove Company Limited
AS132063,KITTI BOONMEE
AS132117,Ministry of Interior
AS132133,"SB.Furniture House Co.,Ltd"
AS132172,Fiscal Policy Office
AS132201,Land and Houses Bank Public Company Limited
AS132250,Princess of Naradhiwas University
AS132280,Symphony Communication (Thailand) PCL.
AS132300,"NIPA TECHNOLOGY CO., LTD"
AS132482,Rajamangala University of Technology Rattanakosin
AS132493,"Lampang-Meatha Rd., Thambon Chomphu Ampher Maung Lampang 52100"
AS132514,"Ubon Ratchathani University,"
AS132541,"Better Web Co., Ltd"
AS132545,Sapanan General Food
AS132605,"KTB General Services Co.,Ltd"
AS132618,Real Future Company Limited
AS132681,"AIN Globalcomm Limited., Company."
AS132821,"Trinity Securities Co., Ltd."
AS132838,"United Information Highway Co.,Ltd."
AS132866,Rajamangala University of Technology Suvarnabhumi under UniNet Network
AS132876,Symphony Communication (Thailand) PCL.
AS132879,Rajabhat Mahasarakham University
AS133042,Office of the basic education commission
AS133063,KGI Securities (Thailand) PLC.
AS133163,PP Ontime Company Limited
AS133167,"TMB Bank, Phahonyothin branch. ,"
AS133193,Provincial Electricity Authority (PEA)
AS133328,Bangkok Patana School
AS133376,"LAZADA Co.,Ltd."
AS133481,AIS Fibre
AS133504,"PAOCLOUD CO., LTD."
AS133529,Land and Houses Bank Public Company Limited
AS133540,KIRZ at Telehouse Thailand
AS133543,"DTAC TriNet Co.,Ltd."
AS133581,"Thailand Post Co,.Ltd."
AS133760,"Electronics Extreme Co., Ltd"
AS133761,Mr. Naphat
AS133791,Teledirect Telecommerce
AS133848,Internet Datacenter Network
AS133880,The Thai Red Cross Society
AS133907,Mr. Danai Chudtong
AS133909,Siam E Business Limited Partnership
AS133919,"University campus network, Rajamangala University of Technology Phra Nakhon"
AS133947,Metropolitan Electricity Authority
AS133956,"Toptrader Co.,Ltd"
AS134064,The Chulabhorn Graduate Institute Campus Network Member of UniNet
AS134073,The Revenue Department
AS134089,JasTel Network
AS134095,National ITMX Company Limited
AS134100,"Express Data Co.,Ltd"
AS134137,True Internet Data Center Company Limited
AS134162,ADVANCED WIRELESS NETWORK COMPANY LIMITED
AS134166,Internet Data Center Service
AS134240,Super Broadband Network Company Limited
AS134461,National Health Security Office (NHSO)
AS134509,1-TO-ALL COMPANY LIMITED
AS134565,National Telecom Public Company Limited
AS134592,"Shopee (Thailand) Co., Ltd."
AS134682,KGI Securities (Thailand) Public Company Limited
AS134686,Krungsri Securities Public Company Limited
AS134690,Chulachomklao Royal Military academy member of UniNet
AS134695,Mass Rapid Transit Authority of Thailand
AS134718,OSD Internet Company Limited
AS134811,Treasury Department
AS134826,"Softde'but Co.,LTD."
AS134839,PropertyGuru Pte Ltd
AS135012,Suan Dusit University
AS135034,Planet Communications Asia Public Company Limited
AS135063,POP NIX COMPANY LIMITED
AS135129,Rajamangala University of Technology Tawan-ok(Bangpra Campus)
AS135141,Rajamangala University of Technology Lanna
AS135290,SAN-IDC
AS135329,Small And Medium Enterprise Development Bank Of Thailand c/o Symphony Communication Public Company L
AS135381,SiS Distribution (Thailand) Public Company Limited descr: (@Genesis Data Center)
AS135419,"Cableconnect Co.,Ltd"
AS135511,CS Loxinfo Public Company Limited
AS135528,Muban Chombueng Rajabhat University
AS135529,Interlink Telecom Public Company Limited
AS135566,National Telecom Public Company Limited
AS135586,INTERLINK COMMUNICATION PCL.
AS135588,Rajamangala University of Technology Tawan-ok (Chakrabongse Bhuvanarth Campus)
AS135616,Name: Thaksin University
AS135620,"69 Praksa, Maueng, Samukprakarn,"
AS135635,Tourism authority of Thailand
AS135670,"Thai Insurers Datanet Co., Ltd."
AS135676,National Institute for Emergency Medicine
AS136023,"PTE Group Co., Ltd"
AS136035,Department of Tourism
AS136040,"Mitr Phol Sugar Corp., Ltd."
AS136158,"UOB Asset Management (Thailand) Co., Ltd."
AS136182,Bualuang-ventures-company-limited
AS136393,Symphony Communication (Thailand) PCL.
AS136457,"Tesco Lotus - 2nd Floor, 3109 Ladpro Road,"
AS136458,"BKNIX Co.,Ltd."
AS136485,"Chunghwa Telecom (Thailand) Co., Ltd."
AS136496,Dhurakij Pundit University
AS136523,"COLODEE DIGITAL NETWORK CO.,LTD."
AS136538,AIS SUPER WiFi
AS136565,CyberWorld
AS136566,"CyberWorld Data Center Co.,Ltd."
AS136579,"Fuji Xerox (Thailand) Co., Ltd."
AS136581,Apple Wealth Securities
AS136624,Sakon Nakhon Rajabhat University
AS136737,Rajamangala University of Technology Krungtep
AS136781,Department of Alternative Energy Development and Efficiency
AS136906,NJ Network Company Limited 96/26
AS136942,Brothers Pictures Company Limited
AS137058,Aeronautical Radio of Thailand Ltd.
AS137198,Phranakorn Rajabhat University
AS137241,PibulSongkramRajabhat University
AS137261,Education Network
AS137392,KTB Securities (Thailand) Company Limited
AS137394,Dhonburi Rajabhat University
AS137422,Bupa Health Insurance (Thailand) Public Company Limited
AS137489,Pi Securities Public Company Limited
AS137545,KPN AWARD
AS137546,"Faculty of Engineering , Rajamangala University of"
AS137557,"International gateway co., Ltd"
AS137566,Supernap Thailand Company Limited
AS137850,Mae Fah Luang University
AS137856,Thai Network Information Center Foundation
AS137875,"Kondotthai Co., Ltd."
AS137876,Tencent (Thailand) Company Limited
AS137885,Capital Nomura Securities PLC
AS137919,"BTS Building, 1000 Phahonyothin Rd., Chomphon, Chatuchak Bangkok 10900 Thailand"
AS137977,ONE TO ONE CONTACTS PUBLIC COMPANY LIMITED descr: Bangkok
AS138003,Royal Police Cadet Academy
AS138156,"CSNE Co., Ltd."
AS138204,"Sophon Broadband Networks co.,ltd"
AS138215,Royal Thai Police
AS138344,"MSIG Insurance (Thailand) Co., Ltd., Installation Site MSIG Insurance (Thailand) Co., Ltd., Kwang, K"
AS138353,NIST INTERNATIONAL SCHOOL
AS138422,"Unit 3910 Tower 2, 39th Fl. Empire Tower Building, 1 Sathorn Sathorn Rd. Sathorn Bangkok 10120"
AS138427,Thailand Institute of Nuclear Technology (Public Organization)
AS138434,"INEXT Broadband Co., Ltd"
AS138466,"DataMossa Co., Ltd."
AS138494,"Campana TARO Co., Ltd."
AS138524,Triple T Broadband Public Company Limited
AS138547,Ubon Ratchathani Rajabhat University
AS138616,"Sanuk Systems (Thailand) Co., Ltd"
AS138618,Thanachart Securities Public Company Limited
AS138670,Ngern Tid Lor Company Limited
AS138685,Mahidol Wittayanusorn School
AS138691,Bangkok Airways Public Company Limited.
AS138906,Ministry of Culture
AS138962,Bangkok Insurance Public Company Limited
AS138967,"SineManage Network Service co.,Ltd"
AS139014,Next Route Company Limited
AS139082,Singha Estate Public Company Limited
AS139295,True Universal Convergence co. ltd
AS139313,AYUDHYA CAPITAL SERVICES COMPANY LIMITED
AS139329,Siam Piwat Company Limited
AS139339,"PT CONNECTION IT CO., LTD"
AS139591,National Telecom Public Company Limited
AS139657,University of the Thai Chamber of Commerce
AS139702,Central Investigation Bureau
AS139724,Tobacco Authority of Thailand
AS139753,"Valaya Alongkorn Rajabhat University Under The Royal Patronage,"
AS139889,Department of Fisheries
AS139892,Metropolitan Waterworks Authority
AS140032,United Overseas Bank (Thai) Public Company Limited
AS140075,Roi et Rajabhat University
AS140305,Apex Circuit (Thailand) Company Limited.
AS140326,Symphony Communication Public Company Limited for TC
AS140575,National Statistical Office
AS140618,Silpakorn University
AS140660,Satit Pattana School
AS140662,AEON Thana Sinsap (Thailand) Public Company Limited
AS140689,AIOI BANGKOK INSURANCE PCL.
AS140699,Royal Thai Army
AS140706,MAYBANK KIM ENG SECURITIES PTE. LTD
AS140725,Thai Customs Department
AS140867,"International gateway co., Ltd"
AS140918,CMKL University
AS140983,Dhipaya Insurance Public Co. Ltd.
AS140985,"Global Innovative Solution Co., LTD"
AS141162,CIMB Thai Bank Public Company Limited
AS141207,Thai Life Insurance PCL.
AS141214,Geo-Informatics and Space Technology Development Agency
AS141362,"Thai Name Server Co.,ltd."
AS141685,KTBCS VAYUPAK
AS141692,PTT Global Chemical Public Company Limited
AS141714,Nakhon Pathom Rajabhat University
AS141715,"Apex Circuit (Thailand) Co.,Ltd."
AS141736,"Wisepaq Business Solutions Provider Co., Ltd."
AS142029,Ascend Money
AS142108,Rotko Networks
AS142131,AEON Thana Sinsap (Thailand) Public Company Limited
AS142299,"CLOUDFOREST CO., LTD."
AS142435,HGC Global Communications (Thailand) Limited
AS142437,"Thai Name Server Co., Ltd."
AS142554,"Vivi 23 Co.,Ltd"
AS142599,Major Cineplex Group Ltd.
AS142609,Symphony Communication Public Company Limited
AS146996,DEXSERVER
AS147027,Royal Thai Armed Force Headquarters
AS147176,"NZ Network Enterprise Co., Ltd."
AS147187,Bualuang Securities
AS147300,"T.H.NIC Co.,Ltd."
AS147312,Songkhla Rajabhat University Network.
AS148997,KTB COMPUTER SERVICES COMPANY LIMITED
AS149036,Waterfront Hotel c/o Symphony Communication Public Company Limited
AS149503,Name: Mahamakut Buddhist University network.
AS149640,"15A Changi Business Park Central 1 Eightrium # 03-03/04, Singapore 486035"
AS149762,"Hakuhodo (Bangkok) Co., Ltd."
AS149766,Y.U.T Corporate Company Limited
AS149796,SANGFOR TECHNOLOGIES (THAILAND) COMPANY LIMITED
AS149800,Org: Phramongkutklao College of Medicine.
AS150107,Surundra Rajabhat University
AS150181,FiberTech
AS150300,"The Permanent Secretary, Ministry of Transport of Thailand"
AS150410,Institute of Community Colleges
AS150674,MITSUBISHI MOTORS (THAILAND) COMPANY LIMITED
AS150686,State Railway of Thailand
AS150787,CHANNEL G COMPANY LIMITED
AS151040,"Urban Resort Hotel Co.,Ltd."
AS151672,government agency
AS151780,Metro Systems Corporation Public Company Limited
AS151808,Hatyai University.
AS151825,Rangsit University
AS151985,"King Power Corporation Co., Ltd."
AS152102,AMPOL FOOD PROCESSING LTD. Nakornpathom
AS152127,OneAsia Data Center (BKK1) Company Limited
AS152130,SOMAPA IT
AS152190,Thai Oil Public Company Limited
AS152445,The Government Savings Bank
AS152461,Department of Lands
AS152463,National Telecom Public Company Limited
AS152465,United Overseas Bank (Thai) Public Company Limited
AS152599,YUT-IIG Global Transit Network
AS152664,CIMB Thai Bank Public Company Limited (DR)
AS152694,TISCO Financial Group Public Company Limited
AS152727,"Villa Market JP Co.,Ltd"
AS152734,Maxnito Company Limited
AS152915,The Office of the Securities and Exchange Commission (Head Office)
AS153163,Beyond Securities Public Company Limited
AS153182,Sripatum University
AS153357,"CBSOFT CO., LTD."
AS153363,Cloud HM Company Limited
AS153459,"Thai Suzuki Motor Co., Ltd."
AS153645,Kasikorn Securities
AS153657,"METASMART CO., LTD."
AS153659,TRUE INTERNET CORPORATION CO. LTD.
AS153730,TRUE INTERNET CORPORATION CO. LTD.
AS153746,T Net Network Company Limited
AS153787,S2N IT AND SERVICE COMPANY LIMITED
AS153996,"VP InfoTech Co., Ltd."
AS154088,MI Squared Company Limited (Branch 00003)/JW Marriott Phuket Resort & Spa
AS154117,Mekha Cloud Company Limited
AS154179,Kiatnakin Phatra Securities Public Company Limited
AS154212,G-Able Public Company Limited
AS154255,Internal Security Operations Command
AS154313,"EVERYTHINK DEV CO., LTD."
AS154502,Land and Houses Bank Public Company Limited.
AS154575,Terabyte Plus Public Company Limited
AS17425,Provincial Electricity Authority (PEA)
AS17468,"True Internet Co.,Ltd."
AS17475,"Siam Chaopraya Holdings Co.,Ltd (The Peninsula Bangkok)"
AS17478,Bangkok Metropolitan Administration
AS17479,Chiang Mai University
AS17552,True Online
AS17556,"TRUE INTERNET Co.,Ltd."
AS17565,"Advance Datanetwork Communications Co.,Ltd. BuddyB service. Bangkok"
AS17724,Total Access Communication PLC.
AS17823,"T.H.NIC Co.,Ltd."
AS17827,Sukhothai Thammathirat Open University
AS17887,"T.C.C. Technology Co., Ltd."
AS17901,One to One Contacts Public Company Limited.
AS17980,"United Securities Public Co.,Ltd."
AS18197,"TOYOTA MOTOR ASIA PACIFIC Engineering and Manufacturing,"
AS18252,National Telecom Public Company Limited
AS18256,Bank of Ayudhya Public Company Limited.
AS18356,Aware Corporation
AS18362,"Netway Communication Co.,Ltd."
AS18408,CSLOXINFO
AS18409,"Bank of Thailand, Bangkok, Thailand"
AS199884,"RACKTECH CO., LTD."
AS200181,Mongkol Mutimal
AS201288,"TimeCost Network Systems Co.,Ltd."
AS202828,Patcharakorn Communication Limited Partnership
AS205977,Pich Tantichukiatikul
AS215748,"Westeros Communications (THAILAND) CO., LTD."
AS216049,Kullawat Chaowanawatee
AS23602,DTAC (CRIE Project)
AS23644,Government Savings Bank
AS23683,"BoonRawd Brewery Co.,LT"
AS23687,The Institute for the Promotion of Teaching Science
AS23883,"Movaci Co., Ltd"
AS23884,Proen Corp Public Company Limited.
AS23891,Phatra Securities
AS23892,United Communication Industry PCL.
AS23919,Ramkhamhaeng University
AS23925,"Siam Sport Syndicate Public Co.,Ltd."
AS23927,Telecommunication Inc.
AS23932,Internet Service Provider
AS23969,TOT Public Company Limited
AS23974,Ministry of education
AS24040,"DataOne Asia (Thailand) Co.,Ltd."
AS24042,"Bangkok Airways Co., Ltd."
AS24060,KTB COMPUTER SERVICES COMPANY LIMITED
AS24067,"TRUE INTERNET Co.,Ltd."
AS24083,Siam City Cement Public Company Limited
AS24097,CSLOXINFO Project for Magnecomp Precision
AS24128,Phuket Internet Co.. Ltd
AS24187,KIRZ Service Provider
AS24190,The Stock Exchange of Thailand
AS24214,CSLOXINFO
AS24237,Siam City Cement Public Company Limited (SCCC)
AS24326,"TT&T PUBLIC COMPANY LIMITED 252/30 Muang Thai-Phatra Complex Tower1 24 Flr, Ratchadaphisek Road, Hua"
AS24328,Yala Rajabhat University Education
AS24344,Chiangmai Rajabhat University
AS24378,Total Access Communication PLC.
AS24393,The Secretariat of House of the Representive
AS24453,Chandrakasem Rajabahat University
AS24455,The Siam Cement Group
AS24465,"Kasikorn Securities PCL,"
AS24475,ThaiREN.Thailand Research and Education Network Thailand
AS24540,THAI AIRWAYS INTERNATIONAL PUBLIC COMPANY
AS37930,Local ISP National Internet eXchange Point (NIXP)
AS37932,Rajamangala University of Technology Isan
AS37983,CSLOXINFO
AS37992,Thammasat University in thailand
AS38034,CSLOXINFO
AS38040,TOT Public Company Limited
AS38081,"True International Gateway Co., Ltd."
AS38082,"True International Gateway Co., Ltd."
AS38184,Thaivivat Insurance
AS38228,"Ministry Of Defence, Thailand"
AS38231,"CIMB Securities Co., Ltd."
AS38265,Sisaket Rajabhat University
AS38293,Ministry of Foreign Affairs
AS38296,National Science and Technology Development Agency
AS38326,Chiva-Som international
AS38328,Ministry of Finance
AS3836,"Thai Social/Scientific, Academic and Research Network"
AS3839,Chulalongkorn University
AS38443,Advanced Wireless Network
AS38444,Super Broadband Network
AS38448,ASIA PLUS SECURITIES PUBLIC COMPANY LIMITED
AS38450,Ministry of Infomation Communication Technology
AS38554,ICL (THAILAND)
AS38566,NTTCTNET
AS38589,Education Network
AS38718,CSLOXINFO
AS38794,UIH
AS38815,"Classic Gold Futers Co.,Ltd."
AS38820,CSLOXINFO
AS38886,"The Government Lottery Office, Thailand"
AS38888,"Milcom Co., Ltd. Internet Service Provider Bangkok"
AS401819,Esker Broadband LLC
AS402386,Settledin LLC
AS402402,Infoecell Tech LLC
AS4274,Assumption University
AS45173,Seamico Securities Public Company Limited
AS45197,"Boonthavorn Co., Ltd."
AS45223,"World Internetwork Co.,Ltd , Thailand."
AS45229,"United Nation - Property Management Sub-unit, Thailand"
AS45248,"United Information Highway Co.,Ltd"
AS45254,"Internet Solution & Service Provider Co., Ltd."
AS45255,"Hi-tech Nittsu (Thailand) Co.,Ltd."
AS45265,CSLOXINFO Transit AS with Domestic (National Internet Exchange)
AS45413,ServeNET Solution Limited Partnership
AS45430,SBN-IIG/AWN-IIG transit provider
AS45441,"SheepLink Co.,Ltd."
AS45455,"Two S One N Co Ltd, Internet Service Provider and IT Solutions"
AS45458,SBN-ISP/AWN-ISP and SBN-NIX/AWN-NIX
AS45530,Agoda Company Pte. Ltd.
AS45533,Comptroller General's Department
AS45537,C/o Cs Loxinfo Public Company Limited
AS45575,Rajamangala University of Technology Srivijaya
AS45581,INFONET THAILAND ISP
AS45629,JasTel Network International Gateway
AS45642,Jasmine International Tower
AS45652,VPLS ASIA
AS45667,"TCC Technology Co.,Ltd."
AS45752,Provincial waterworks authority
AS45758,Triple T Broadband Public Company Limited
AS45781,NB-IoT
AS45796,UIH / BB Connect
AS45800,"Suan sunandha Rajabhat University, which is one university in Thailand"
AS45806,Siam Commercial Bank
AS45847,"university network ,Nakornsitammarat, Thailand"
AS45959,"Thai Reinsurance Public Co., Ltd."
AS4618,Internet Thailand Company Limited
AS4621,UNINET-TH
AS4651,National Telecom Public Company Limited
AS4652,National Telecom Public Company Limited
AS4741,"Samart Infonet Co., Ltd."
AS4750,CS LOXINFO PUBLIC COMPANY LIMITED
AS4762,"Mahidol University, Thailand"
AS4767,Computer Science
AS4776,"A-Net Co., Ltd."
AS4827,CSLOXINFO
AS55325,Eastern Water Resources Development and Management Company
AS55403,PTT Digital Solutions Company Limited
AS55423,JasTel Network
AS55451,Office of the National Broadcasting and
AS55476,"CP All Public Co., Ltd."
AS55488,Nakorn Ratchasima Rajabhat University
AS55490,True Move Company Limited
AS55498,"Greenline Synergy Co.,Ltd."
AS55514,Electricity Generating Authority of Thailand (EGAT)
AS55538,"CIMB Securities (Thailand) Co.,Ltd."
AS55545,Suranaree University of Technology
AS55554,"True International Gateway Co., Ltd."
AS55634,"Kasikorn Asset Management Co.,Ltd."
AS55642,Control Data (Thailand) Ltd
AS55760,Mahanakorn University Of Technology
AS55790,"408/81 19 th Fl.,Phaholyotin Place Building"
AS55808,Triple T Broadband Public Company Limited
AS55844,142 KASIKORNBANK Building 4th Floor Silom Road Suriyawong Bangrak Bangkok 10500
AS55925,"469 Nakronsawan.Rd, Chidrada Dusit"
AS55927,"UOB Kay Hian Securities (Thailand) Co., Ltd."
AS55932,The Thai Bond Market Association
AS55938,Expressway Authority of Thailand
AS56018,CIMB Securities (Thailand) Company Limited
AS56067,453 Ladplacout Jorakhaebua
AS56112,"Muang Thai Life Assurance Co., Ltd."
AS56117,209/1
AS56118,"Office of the Civil Service Commission 47/111 Tiwanon Road, Talad Kwan Sub-District, Muang District,"
AS56120,TOT Public Company Limited
AS56223,"Thai Summit Autopart Industry Co.,Ltd"
AS56277,Office of Info.Tech. Admin. for Educational Development
AS56309,"Siamdata Communication Co.,Ltd."
AS58370,JasTel Network
AS58430,"TCC Technology Co., Ltd."
AS58690,"Internet East Co., Ltd."
AS58930,My Telecom Group Company Limited
AS58955,"Bangmod Enterprise Co., Ltd."
AS59238,"Innovative Extremist Co., Ltd."
AS59374,Bangmod Enterprise
AS63528,Bangkok Neutral Internet Exchange
AS63529,Bangkok Neutral Internet Exchange Route Servers
AS63940,dragonhispeed
AS63951,THAICOM Public Company Limited
AS63972,88/28 Moo 4 Tiwanont Road Nonta-Buri Province 11000
AS63989,DE-CORP
AS7470,"TRUE INTERNET Co.,Ltd."
AS7485,Samart - Advanced Metering Infrastructure(AMI)
AS7568,CS LOXINFO Public Company Limited.
AS7588,Thailand Public backbone Network
AS7616,JasTel Network
AS7630,KASIKORNBANK PUBLIC COMPANY LIMITED
AS7636,"Far East Internet Co., Ltd."
AS7693,KSC Commercial Internet Co. Ltd.
AS7715,GSB
AS9287,True Internet Data Center Company Limited
AS9335,National Telecom Public Company Limited
AS9339,CSLOXINFO
AS9411,"Kasetsart University, Thailand"
AS9464,Prince of Songkla University (Sritrang'NET)
AS9475,Walailuk University
AS9486,King Mongkut's Institute of Technology Ladkrabang
AS9533,King Mongkut's Institute of Technology North Bangkok
AS9546,Ministry of University Affairs
AS9551,King Mongkut's University of Technology
AS9562,Mahasarakham University
AS9587,DTAC NETWORK
AS9715,SAMART Corp (Excise-Direct Coding Data Center)
AS9835,Government Information Technology Services
AS9891,CS LOXINFO Public Company Limited.
AS9903,Rajamangala Institute of Technology
AS9931,National Telecom Public Company Limited
